AO-nr.;AO-type;Oppgave/feilbeskrivelse;Reg.nr.;Utstyrsgruppe;Modell;Seneste PV;Neste PV;Oppdatert;Oppdatert av Sign;Reg. dato;Ferdig;Sign;Teknisk beskrivelse;Plassering (utstyr);Gruppe;Kundekode;Kunde;Sak;Kundetekst;Totalt;Nedetid;Plassering;;;;;;;;;;;;;;;;;;;;;;;;;;;;;
HST161199;Normal/Akutt;Dårlig kontakt ved tilkobling av nøytral plate.;011451;Diatermi, universal, komplett;ESG-100;11.03.2024;;;;11.07.2016;18.08.2016;Bjarte Nærland (nebj);Apparatet er reparert av leverandøren. Byttet div. deler.;"Med. gastro poliklinikk ; Gastroseksjon ; Medisinsk avdeling ; Mottaksklinikken ; Helse Stavanger HF ; Helse Vest RHF";;114271;"Gastroenterologisk kirurgisk avdeling ; Klinikk for kirurgi, nevrologi og rehabilitering ; Helse Stavanger HF ; Helse Vest RHF";;;0,00;0,00;"Kirurgisk gastropol ; Gastroenterologisk kirurgisk avdeling ; Klinikk for kirurgi, nevrologi og rehabilitering ; Helse Stavanger HF ; Helse Vest RHF";;;;;;;;;;;;;;;;;;;;;;;;;;;;;
HST161273;PV;Enkel kontroll av funksjon, eksteriør, effekt og lekkstrøm.;013000;Diatermi, universal, komplett;Force FX-8CA;11.03.2020;;;;24.07.2016;05.07.2019;Cato Che Ho Mak (catmak);Se Jobb nr. 182825;"Sentraloperasjon 2 ; Operasjonsavdeling ; Klinikk A ; Helse Stavanger HF ; Helse Vest RHF";;114291;"Operasjonsavdeling ; Klinikk A ; Helse Stavanger HF ; Helse Vest RHF";;;0,00;0,00;"Sentraloperasjon 2 ; Operasjonsavdeling ; Klinikk A ; Helse Stavanger HF ; Helse Vest RHF";;;;;;;;;;;;;;;;;;;;;;;;;;;;;
HST161627;Normal/Akutt;Skjermen er gått i svart.;009630;Diatermi, universal, komplett;ME 402;28.02.2023;;;;25.07.2016;23.09.2016;Morten Ruud (rumo);Langtidstestet uten å finne feil...;"Sentraloperasjon 1 ; Operasjonsavdeling ; Klinikk A ; Helse Stavanger HF ; Helse Vest RHF";;114291;"Operasjonsavdeling ; Klinikk A ; Helse Stavanger HF ; Helse Vest RHF";;;0,00;0,00;"Sentraloperasjon 1 ; Operasjonsavdeling ; Klinikk A ; Helse Stavanger HF ; Helse Vest RHF";;;;;;;;;;;;;;;;;;;;;;;;;;;;;
HST170063;Normal/Akutt;PV;014962;Diatermi, universal, komplett;ME 402 Maxium E;21.02.2024;01.05.2028;;;24.05.2016;24.05.2016;Morten Ruud (rumo);"Kontroll utført av Kebomed.  Se servicerapport lagt på typenivå; Ingen anmerkninger";"MTI MU Beredskap ;  ;  ; Avdeling for medisinsk teknologi og informatikk ; Klinikk for medisinsk teknologi ; Helse Stavanger HF ; Helse Vest RHF";;4211587;"Klinikk for kirurgi, nevrologi og rehabilitering ; Helse Stavanger HF ; Helse Vest RHF";;;0,00;0,00;"Kirurgisk avdeling ; Klinikk for kirurgi, nevrologi og rehabilitering ; Helse Stavanger HF ; Helse Vest RHF";;;;;;;;;;;;;;;;;;;;;;;;;;;;;
HST170064;Normal/Akutt;PV;014961;Diatermi, universal, komplett;ME 402 Maxium E;21.02.2024;01.05.2028;;;24.05.2016;24.05.2016;Morten Ruud (rumo);"Kontroll utført av Kebomed.  Se servicerapport lagt på typenivå; Ingen anmerkninger";"Operasjon DK ; Dagkirurgi Hillevåg ; Klinikk A ; Helse Stavanger HF ; Helse Vest RHF";;4211587;"Klinikk for kirurgi, nevrologi og rehabilitering ; Helse Stavanger HF ; Helse Vest RHF";;;0,00;0,00;"Dagkirurgi Hillevåg ; Klinikk A ; Helse Stavanger HF ; Helse Vest RHF";;;;;;;;;;;;;;;;;;;;;;;;;;;;;
HST170066;Normal/Akutt;Kontroll utført i forbindelse med sjekk av diatermi;009634;Diatermi, argonanriket, gassforsyningsenhet;MBS 1;28.02.2023;;;;24.05.2016;24.05.2016;Morten Ruud (rumo);"Kontroll utført av Kebomed.  Se servicerapport lagt på typenivå; Ingen anmerkninger";"Avdeling for medisinsk teknologi og informatikk ; Klinikk for medisinsk teknologi ; Helse Stavanger HF ; Helse Vest RHF";;114291;"Operasjonsavdeling ; Klinikk A ; Helse Stavanger HF ; Helse Vest RHF";;;0,00;0,00;"Sentraloperasjon 1 ; Operasjonsavdeling ; Klinikk A ; Helse Stavanger HF ; Helse Vest RHF";;;;;;;;;;;;;;;;;;;;;;;;;;;;;
HST170067;Normal/Akutt;Kontroll utført i forbindelse med sjekk av diatermien.;009633;Diatermi, argonanriket, gassforsyningsenhet;MBS 1;15.02.2023;;;;24.05.2016;24.05.2016;Morten Ruud (rumo);"Kontroll utført av Kebomed.  Se servicerapport lagt på typenivå; Ingen anmerkninger";"Sentraloperasjon 1 ; Operasjonsavdeling ; Klinikk A ; Helse Stavanger HF ; Helse Vest RHF";;114291;"Operasjonsavdeling ; Klinikk A ; Helse Stavanger HF ; Helse Vest RHF";;;0,00;0,00;"Sentraloperasjon 1 ; Operasjonsavdeling ; Klinikk A ; Helse Stavanger HF ; Helse Vest RHF";;;;;;;;;;;;;;;;;;;;;;;;;;;;;
HST170068;Normal/Akutt;PV;013072;Diatermi, universal, komplett;ME 102;05.02.2024;28.02.2025;;;24.05.2016;24.05.2016;Morten Ruud (rumo);"Kontroll utført av Kebomed.  Se servicerapport lagt på typenivå; Ingen anmerkninger";"Operasjon Øst ; Operasjonsavdeling ; Klinikk A ; Helse Stavanger HF ; Helse Vest RHF";;114291;"Operasjonsavdeling ; Klinikk A ; Helse Stavanger HF ; Helse Vest RHF";;;0,00;0,00;"Operasjon Øst ; Operasjonsavdeling ; Klinikk A ; Helse Stavanger HF ; Helse Vest RHF";;;;;;;;;;;;;;;;;;;;;;;;;;;;;
HST170069;Normal/Akutt;PV;010908;Diatermi, universal, komplett;ME 102;23.01.2024;11.03.2025;;;24.05.2016;24.05.2016;Morten Ruud (rumo);"Kontroll utført av Kebomed.  Se servicerapport lagt på typenivå; Ingen anmerkninger";"Akutt poliklinikk ; MOBA ; Mottaksklinikken ; Helse Stavanger HF ; Helse Vest RHF";;4204955;"Akutt poliklinikk ; MOBA ; Mottaksklinikken ; Helse Stavanger HF ; Helse Vest RHF";;;0,00;0,00;"Akutt poliklinikk ; MOBA ; Mottaksklinikken ; Helse Stavanger HF ; Helse Vest RHF";;;;;;;;;;;;;;;;;;;;;;;;;;;;;
HST170070;Normal/Akutt;PV;012995;Diatermi, universal, komplett;ME 102;05.02.2024;01.03.2025;;;24.05.2016;24.05.2016;Morten Ruud (rumo);"Kontroll utført av Kebomed.  Se servicerapport lagt på typenivå; Ingen anmerkninger";"Operasjon Øst ; Operasjonsavdeling ; Klinikk A ; Helse Stavanger HF ; Helse Vest RHF";;114291;"Operasjonsavdeling ; Klinikk A ; Helse Stavanger HF ; Helse Vest RHF";;;0,00;0,00;"Operasjon Øst ; Operasjonsavdeling ; Klinikk A ; Helse Stavanger HF ; Helse Vest RHF";;;;;;;;;;;;;;;;;;;;;;;;;;;;;
HST170071;Normal/Akutt;PV;012996;Diatermi, universal, komplett;ME MB1 Endo;05.02.2024;28.02.2025;;;24.05.2016;24.05.2016;Morten Ruud (rumo);"Kontroll utført av Kebomed.  Se servicerapport lagt på typenivå; Ingen anmerkninger";"Operasjon Øst ; Operasjonsavdeling ; Klinikk A ; Helse Stavanger HF ; Helse Vest RHF";;114291;"Operasjonsavdeling ; Klinikk A ; Helse Stavanger HF ; Helse Vest RHF";;;0,00;0,00;"Operasjon Øst ; Operasjonsavdeling ; Klinikk A ; Helse Stavanger HF ; Helse Vest RHF";;;;;;;;;;;;;;;;;;;;;;;;;;;;;
HST170072;Normal/Akutt;Avvik fra PV: Må bytte deksel og glass pga. skade.;009569;Diatermi, universal, komplett;ME 402;18.12.2020;;;;12.01.2017;19.12.2018;Cato Che Ho Mak (catmak);Har byttet deksel og skadet glass, testet ok.;"Avdeling for medisinsk teknologi og informatikk ; Klinikk for medisinsk teknologi ; Helse Stavanger HF ; Helse Vest RHF";;114291;"Operasjonsavdeling ; Klinikk A ; Helse Stavanger HF ; Helse Vest RHF";;;0,00;0,00;"MTI Avd. for med. teknologi og informatikk ; Avdeling for medisinsk teknologi og informatikk ; Klinikk for medisinsk teknologi ; Helse Stavanger HF ; Helse Vest RHF";;;;;;;;;;;;;;;;;;;;;;;;;;;;;
HST170073;Normal/Akutt;Fra PV:  Utgang M Coag virker ikke.;009571;Diatermi, universal, komplett;ME 402;20.03.2023;;;;12.01.2017;02.08.2017;Morten Ruud (rumo);"Byttet utganger for monopolar.
OK.";"Sentraloperasjon 1 ; Operasjonsavdeling ; Klinikk A ; Helse Stavanger HF ; Helse Vest RHF";;114291;"Operasjonsavdeling ; Klinikk A ; Helse Stavanger HF ; Helse Vest RHF";;;0,00;0,00;"Sentraloperasjon 1 ; Operasjonsavdeling ; Klinikk A ; Helse Stavanger HF ; Helse Vest RHF";;;;;;;;;;;;;;;;;;;;;;;;;;;;;
HST170074;Normal/Akutt;Fra PV:  Utgang M2 må byttes;009577;Diatermi, universal, komplett;ME 402;28.02.2023;;;;12.01.2017;24.07.2017;Cato Che Ho Mak (catmak);"Har byttet ut matte med en ny og har rengjort overflate.
Utgang M2 er byttet med en ny.";"Avdeling for medisinsk teknologi og informatikk ; Klinikk for medisinsk teknologi ; Helse Stavanger HF ; Helse Vest RHF";;114291;"Operasjonsavdeling ; Klinikk A ; Helse Stavanger HF ; Helse Vest RHF";;;0,00;0,00;"Sentraloperasjon 1 ; Operasjonsavdeling ; Klinikk A ; Helse Stavanger HF ; Helse Vest RHF";;;;;;;;;;;;;;;;;;;;;;;;;;;;;
HST170138;Normal/Akutt;Brukerne klagde på at den slo seg av hele tiden.;009553;Diatermi, universal, komplett;ME 402;28.02.2023;;;;23.01.2017;23.01.2017;Morten Ruud (rumo);Sannsynligvis bare nettleder som har lett for å dette ut.  Erstattet med en ny som satt litt bedre.;"Avdeling for medisinsk teknologi og informatikk ; Klinikk for medisinsk teknologi ; Helse Stavanger HF ; Helse Vest RHF";;114291;"Operasjonsavdeling ; Klinikk A ; Helse Stavanger HF ; Helse Vest RHF";;;0,00;0,00;"Sentraloperasjon 1 ; Operasjonsavdeling ; Klinikk A ; Helse Stavanger HF ; Helse Vest RHF";;;;;;;;;;;;;;;;;;;;;;;;;;;;;
HST170197;Normal/Akutt;Kontroll i forbindesle med sjekk av diatermiapparatet.;008334;Diatermi, argonanriket, gassforsyningsenhet;10132-010;09.01.2024;;;;31.01.2017;31.01.2017;Morten Ruud (rumo);Elektrisk sikkerhetstest.  Visuell kopntrolll.  Brukerne rapproterer ingen problemer.;"Kirurgisk gastropol ; Gastroenterologisk kirurgisk avdeling ; Klinikk for kirurgi, nevrologi og rehabilitering ; Helse Stavanger HF ; Helse Vest RHF";;114271;"Gastroenterologisk kirurgisk avdeling ; Klinikk for kirurgi, nevrologi og rehabilitering ; Helse Stavanger HF ; Helse Vest RHF";;;0,00;0,00;"MTI Avd. for med. teknologi og informatikk ; Avdeling for medisinsk teknologi og informatikk ; Klinikk for medisinsk teknologi ; Helse Stavanger HF ; Helse Vest RHF";;;;;;;;;;;;;;;;;;;;;;;;;;;;;
HST170482;Normal/Akutt;skjermen er rar og sfifter farge, flimrer og har struce;009570;Diatermi, universal, komplett;ME 402;28.02.2023;;;;08.03.2017;08.03.2017;Benoit Nikunze Bicenene (nbenoi);ME402 connection cable screen er byttet ut, apparatet er testet og ser ut til å fungere fint;"Avdeling for medisinsk teknologi og informatikk ; Klinikk for medisinsk teknologi ; Helse Stavanger HF ; Helse Vest RHF";;114291;"Operasjonsavdeling ; Klinikk A ; Helse Stavanger HF ; Helse Vest RHF";;;0,00;0,00;"Sentraloperasjon 1 ; Operasjonsavdeling ; Klinikk A ; Helse Stavanger HF ; Helse Vest RHF";;;;;;;;;;;;;;;;;;;;;;;;;;;;;
HST170484;Normal/Akutt;svart skjerm;009630;Diatermi, universal, komplett;ME 402;28.02.2023;;;;08.03.2017;08.03.2017;Benoit Nikunze Bicenene (nbenoi);ME402 connection cable screen HW-03. er byttet ut. Morten har testet apparatet apparaett grundig over flere dager og er konstatert at feilen dukker opp og går. Ny kabel er nå satt inn og apparatet er testet og funger bra;"Sentraloperasjon 1 ; Operasjonsavdeling ; Klinikk A ; Helse Stavanger HF ; Helse Vest RHF";;114291;"Operasjonsavdeling ; Klinikk A ; Helse Stavanger HF ; Helse Vest RHF";;;0,00;0,00;"Sentraloperasjon 1 ; Operasjonsavdeling ; Klinikk A ; Helse Stavanger HF ; Helse Vest RHF";;;;;;;;;;;;;;;;;;;;;;;;;;;;;
HST171543;Normal/Akutt;Ødelagt ledning på pedal.;015003;Diatermi, universal, komplett;ME 402;16.08.2024;28.03.2025;;;21.07.2017;21.07.2017;* Erik Sæland HAFNOR (erihaf);Reparert (kortet inn) ledning på pedal.;"Avdeling for medisinsk teknologi og informatikk ; Klinikk for medisinsk teknologi ; Helse Stavanger HF ; Helse Vest RHF";;114291;"Operasjonsavdeling ; Klinikk A ; Helse Stavanger HF ; Helse Vest RHF";;;750,00;0,00;"Sentraloperasjon 1 ; Operasjonsavdeling ; Klinikk A ; Helse Stavanger HF ; Helse Vest RHF";;;;;;;;;;;;;;;;;;;;;;;;;;;;;
HST171567;Normal/Akutt;Skifter matte.;009572;Diatermi, universal, komplett;ME 402;21.08.2024;15.03.2025;;;28.07.2017;28.07.2017;Cato Che Ho Mak (catmak);Matte er skiftet og har rengjort overflate.;"Sentraloperasjon 1 ; Operasjonsavdeling ; Klinikk A ; Helse Stavanger HF ; Helse Vest RHF";;114291;"Operasjonsavdeling ; Klinikk A ; Helse Stavanger HF ; Helse Vest RHF";;;0,00;0,00;"Sentraloperasjon 1 ; Operasjonsavdeling ; Klinikk A ; Helse Stavanger HF ; Helse Vest RHF";;;;;;;;;;;;;;;;;;;;;;;;;;;;;
HST171586;Normal/Akutt;Nøytral utgang er defekt.;009553;Diatermi, universal, komplett;ME 402;28.02.2023;;;;01.08.2017;01.08.2017;Cato Che Ho Mak (catmak);Har byttet med en ny, har testet og er Ok.;"Avdeling for medisinsk teknologi og informatikk ; Klinikk for medisinsk teknologi ; Helse Stavanger HF ; Helse Vest RHF";;114291;"Operasjonsavdeling ; Klinikk A ; Helse Stavanger HF ; Helse Vest RHF";;;0,00;0,00;"Sentraloperasjon 1 ; Operasjonsavdeling ; Klinikk A ; Helse Stavanger HF ; Helse Vest RHF";;;;;;;;;;;;;;;;;;;;;;;;;;;;;
HST171587;Normal/Akutt;Svart skjerm.;009577;Diatermi, universal, komplett;ME 402;28.02.2023;;;;01.08.2017;01.08.2017;Cato Che Ho Mak (catmak);"Løs kontakt.
Har rettet problem, har testest og er ok.";"Avdeling for medisinsk teknologi og informatikk ; Klinikk for medisinsk teknologi ; Helse Stavanger HF ; Helse Vest RHF";;114291;"Operasjonsavdeling ; Klinikk A ; Helse Stavanger HF ; Helse Vest RHF";;;0,00;0,00;"Sentraloperasjon 1 ; Operasjonsavdeling ; Klinikk A ; Helse Stavanger HF ; Helse Vest RHF";;;;;;;;;;;;;;;;;;;;;;;;;;;;;
HST171589;Normal/Akutt;"Kraftig Røyklukt!  
Enten fra dette apparatet eller røykavsuget.";009571;Diatermi, universal, komplett;ME 402;20.03.2023;;;;02.08.2017;11.10.2017;Cato Che Ho Mak (catmak);"Stina var oppe på stua og registrerte en kraftig røyklukt.  Tok det og røykasug ned på MTI, og når vi startet opp her, var det flere som også reagerte på lukt.  Men, det virket som om den forsvant etterhvert.
(Utgang for nøytralplate er fra et annet apparat og virker dårlig; vi brukte dette som deleapparat, da det andre apparatet hadde problemer med korrekt motstandsmåling på NE-monitoreeringa.)
Sendes Kebomed for sjekk.

11.10.17: Apparatet er reparert og er blitt testet ok.";"Sentraloperasjon 1 ; Operasjonsavdeling ; Klinikk A ; Helse Stavanger HF ; Helse Vest RHF";;114291;"Operasjonsavdeling ; Klinikk A ; Helse Stavanger HF ; Helse Vest RHF";;;0,00;0,00;"Sentraloperasjon 1 ; Operasjonsavdeling ; Klinikk A ; Helse Stavanger HF ; Helse Vest RHF";;;;;;;;;;;;;;;;;;;;;;;;;;;;;
HST171719;Normal/Akutt;Feil i kobling til diatermiplate. Fungerer en liten stud når ny kabel til plate settes inn.;009553;Diatermi, universal, komplett;ME 402;28.02.2023;;;;18.08.2017;18.08.2017;Morten Ruud (rumo);"Flere feilkilder her:
 De har et adapter for å bruke Valleylab sin nøytralplatekobling.  Den kunne trykkes litt lengre inn enn samme type adapter fra Erbe.  Da var det lett at det ble dårlig kobling mellom plugg og apparat.
I tillegg var det ikke helt lett å få kontakt mellom nøytralplateledningen og nøytralplata.  Så den ble kassert.
Sjekket at diatermiapparatet bar korrekt justert og alarmerte slik den skulle iflg. servicemanual.
OK";"Avdeling for medisinsk teknologi og informatikk ; Klinikk for medisinsk teknologi ; Helse Stavanger HF ; Helse Vest RHF";;114291;"Operasjonsavdeling ; Klinikk A ; Helse Stavanger HF ; Helse Vest RHF";;;0,00;0,00;"Sentraloperasjon 1 ; Operasjonsavdeling ; Klinikk A ; Helse Stavanger HF ; Helse Vest RHF";;;;;;;;;;;;;;;;;;;;;;;;;;;;;
HST171982;Normal/Akutt;"Den gule fotpedalen til Diatermi apparatet virker ikke.
En fjær er knekt.";009557;Diatermi, universal, komplett;UES-40;27.10.2021;;;;26.09.2017;26.09.2017;Cato Che Ho Mak (catmak);Har skiftet fjær og er ok.;"Sentraloperasjon 1 ; Operasjonsavdeling ; Klinikk A ; Helse Stavanger HF ; Helse Vest RHF";;114291;"Operasjonsavdeling ; Klinikk A ; Helse Stavanger HF ; Helse Vest RHF";;;0,00;0,00;"Sentraloperasjon 1 ; Operasjonsavdeling ; Klinikk A ; Helse Stavanger HF ; Helse Vest RHF";;;;;;;;;;;;;;;;;;;;;;;;;;;;;
HST172031;PV;Forebyggende vedlikehold;010027;Diatermi, universal, komplett;UES-40;31.10.2017;;;;25.10.2016;26.10.2016;Bjarte Nærland (nebj);FVH utført av leverandør, se vedlegg.;"Avdeling for medisinsk teknologi og informatikk ; Klinikk for medisinsk teknologi ; Helse Stavanger HF ; Helse Vest RHF";;114291;"Operasjonsavdeling ; Klinikk A ; Helse Stavanger HF ; Helse Vest RHF";;FVH utført av leverandør, se vedlegg.;0,00;0,00;"Dagkirurgi SYD ; Operasjonsavdeling ; Klinikk A ; Helse Stavanger HF ; Helse Vest RHF";;;;;;;;;;;;;;;;;;;;;;;;;;;;;
HST172040;PV;FVH.;009558;Diatermi, universal, komplett;UES-40;12.03.2024;;;;01.10.2016;27.10.2016;Bjarte Nærland (nebj);FVH utført av leverandør, se vedlegg.;"Operasjon DK ; Dagkirurgi Hillevåg ; Klinikk A ; Helse Stavanger HF ; Helse Vest RHF";;114291;"Operasjonsavdeling ; Klinikk A ; Helse Stavanger HF ; Helse Vest RHF";;FVH utført av leverandør, se vedlegg.;0,00;0,00;"Sentraloperasjon 1 ; Operasjonsavdeling ; Klinikk A ; Helse Stavanger HF ; Helse Vest RHF";;;;;;;;;;;;;;;;;;;;;;;;;;;;;
HST172044;PV;FVH;015144;Diatermi, universal, komplett;ESG-400;02.07.2024;;;;01.10.2016;27.10.2016;Bjarte Nærland (nebj);FVH utført av leverandør, se vedlegg.;"Operasjon DK ; Dagkirurgi Hillevåg ; Klinikk A ; Helse Stavanger HF ; Helse Vest RHF";;4208011;"Dagkirurgi Hillevåg ; Klinikk A ; Helse Stavanger HF ; Helse Vest RHF";;FVH utført av leverandør, se vedlegg.;0,00;0,00;"Dagkirurgi Hillevåg ; Klinikk A ; Helse Stavanger HF ; Helse Vest RHF";;;;;;;;;;;;;;;;;;;;;;;;;;;;;
HST172185;Normal/Akutt;Brukeren klagde på feil og må kontrolleres.;006260;Diatermi, universal, komplett;10122-041;27.02.2024;16.03.2025;;;12.10.2017;12.10.2017;Cato Che Ho Mak (catmak);"Har testet alle funksjoner og målt utgangseffekt. Ok.
Klarer ikke å finne noe feil med apparatet.";"Plast, ØNH, Øye post 2AB ; Øre- nese- hals avdeling ; Klinikk for kirurgi, nevrologi og rehabilitering ; Helse Stavanger HF ; Helse Vest RHF";;4204458;"Operasjon Øst ; Operasjonsavdeling ; Klinikk A ; Helse Stavanger HF ; Helse Vest RHF";;;0,00;0,00;"Plast, ØNH, Øye post 2AB ; Øre- nese- hals avdeling ; Klinikk for kirurgi, nevrologi og rehabilitering ; Helse Stavanger HF ; Helse Vest RHF";;;;;;;;;;;;;;;;;;;;;;;;;;;;;
HST172474;Normal/Akutt;Brukeren klaget på at maskinen luktet svidd og den begynte å lage knurrelyd.;009571;Diatermi, universal, komplett;ME 402;20.03.2023;;;;21.11.2017;21.11.2017;Cato Che Ho Mak (catmak);"Har kjørt maskinen i flere timer, klarte ikke å gjenskape lyden.
Har byttet ut det gamle filteret med et nytt. 
Maskinen er levert tilbake til brukeren.";"Sentraloperasjon 1 ; Operasjonsavdeling ; Klinikk A ; Helse Stavanger HF ; Helse Vest RHF";;114291;"Operasjonsavdeling ; Klinikk A ; Helse Stavanger HF ; Helse Vest RHF";;;0,00;0,00;"Sentraloperasjon 1 ; Operasjonsavdeling ; Klinikk A ; Helse Stavanger HF ; Helse Vest RHF";;;;;;;;;;;;;;;;;;;;;;;;;;;;;
HST172519;Normal/Akutt;"Får ikke ut gass; diatermiapparatet gir varsel om tom flaske selvom det er satt på ny";009634;Diatermi, argonanriket, gassforsyningsenhet;MBS 1;28.02.2023;;;;28.11.2017;08.12.2017;Morten Ruud (rumo);"Verifisert at det er gass på flaske.  Kommer likevel ikke noe ut av regulatoren.  Bestillt ny fra Kebomed.
Ny kom etter ca 2 uker og ble skiftet ut.  OK";"Avdeling for medisinsk teknologi og informatikk ; Klinikk for medisinsk teknologi ; Helse Stavanger HF ; Helse Vest RHF";;114291;"Operasjonsavdeling ; Klinikk A ; Helse Stavanger HF ; Helse Vest RHF";;;0,00;0,00;"Sentraloperasjon 1 ; Operasjonsavdeling ; Klinikk A ; Helse Stavanger HF ; Helse Vest RHF";;;;;;;;;;;;;;;;;;;;;;;;;;;;;
HST172524;Normal/Akutt;Brukerne ønsker kontroll etter at diatermi tok fyr;012996;Diatermi, universal, komplett;ME MB1 Endo;05.02.2024;28.02.2025;;;27.11.2017;29.11.2017;Morten Ruud (rumo);"Operatør hadde fått brent hull i handske og negl samtidig som det hadde vært flammer fra diatermipennen.  De hadde skiftet diatermipenn og fortsatt med samme apparat, og var selv klar på at de trodde det var brukerfeil.  Sjekket apparatet for effekt og lekkasjestrømmer.  Alt normalt.
Elektroden på pennen hadde mye karbonisert materiale. (Bilder lagt i mappe på seksjon).  Det er sannsynligvis rester etter vevet som har tatt fyr, og som (samtidig) har ført til overslag til kirurgens negl  Karbonisert nateriale vil jo føre til høyere motstand på tuppen, og gjøre at strømmen søker andre veier.  Samtidig kan  flamme og røyk gi en mindre motstand for overslag i luft til kirurg.
Sendt apparat opp igjen.
";"Operasjon Øst ; Operasjonsavdeling ; Klinikk A ; Helse Stavanger HF ; Helse Vest RHF";;114291;"Operasjonsavdeling ; Klinikk A ; Helse Stavanger HF ; Helse Vest RHF";;;0,00;0,00;"Operasjon Øst ; Operasjonsavdeling ; Klinikk A ; Helse Stavanger HF ; Helse Vest RHF";;;;;;;;;;;;;;;;;;;;;;;;;;;;;
HST180001;Normal/Akutt;Dødt.;009572;Diatermi, universal, komplett;ME 402;21.08.2024;15.03.2025;;;02.01.2018;22.02.2018;Morten Ruud (rumo);"Intern Sikring F1 var gåen.
Byttet denne, og apparatet virket.  Men, etter en liten stund observerte jeg litt røyk fra en av komponentene rett ved siden av.  Slo av/på noen ganger og da røyk sikring på nytt.

Sendes til Kebomed for sannsynligvis skifte av hovedkort og kalibrering.
De har byttet bl.a. transistor V8.  Som førte til at sikringen gikk.

Kalibrert og testet; OK.";"Sentraloperasjon 1 ; Operasjonsavdeling ; Klinikk A ; Helse Stavanger HF ; Helse Vest RHF";;114291;"Operasjonsavdeling ; Klinikk A ; Helse Stavanger HF ; Helse Vest RHF";;;0,00;0,00;"Sentraloperasjon 1 ; Operasjonsavdeling ; Klinikk A ; Helse Stavanger HF ; Helse Vest RHF";;;;;;;;;;;;;;;;;;;;;;;;;;;;;
HST180140;PV;FVH.;011451;Diatermi, universal, komplett;ESG-100;11.03.2024;;;;01.10.2015;08.10.2015;Bjarte Nærland (nebj);FVH utført av leverandør, se vedlegg.;"Med. gastro poliklinikk ; Gastroseksjon ; Medisinsk avdeling ; Mottaksklinikken ; Helse Stavanger HF ; Helse Vest RHF";;114271;"Gastroenterologisk kirurgisk avdeling ; Klinikk for kirurgi, nevrologi og rehabilitering ; Helse Stavanger HF ; Helse Vest RHF";;FVH utført av leverandør, se vedlegg.;0,00;0,00;"Kirurgisk gastropol ; Gastroenterologisk kirurgisk avdeling ; Klinikk for kirurgi, nevrologi og rehabilitering ; Helse Stavanger HF ; Helse Vest RHF";;;;;;;;;;;;;;;;;;;;;;;;;;;;;
HST180143;PV;FVH;010623;Diatermi, endoskopisk, komplett;PSD-60;07.10.2019;;;;01.10.2015;06.10.2015;Bjarte Nærland (nebj);FVH utført av leverandør, se vedlegg.;"Avdeling for medisinsk teknologi og informatikk ; Klinikk for medisinsk teknologi ; Helse Stavanger HF ; Helse Vest RHF";;114271;"Gastroenterologisk kirurgisk avdeling ; Klinikk for kirurgi, nevrologi og rehabilitering ; Helse Stavanger HF ; Helse Vest RHF";;FVH utført av leverandør, se vedlegg.;0,00;0,00;"MTI Avd. for med. teknologi og informatikk ; Avdeling for medisinsk teknologi og informatikk ; Klinikk for medisinsk teknologi ; Helse Stavanger HF ; Helse Vest RHF";;;;;;;;;;;;;;;;;;;;;;;;;;;;;
HST180151;PV;FVH;016968;Diatermi, universal, komplett;ESG-100;08.03.2024;;;;01.10.2015;05.10.2015;Bjarte Nærland (nebj);FVH utført av leverandør, se vedlegg.;"Med. gastro poliklinikk ; Gastroseksjon ; Medisinsk avdeling ; Mottaksklinikken ; Helse Stavanger HF ; Helse Vest RHF";;114271;"Gastroenterologisk kirurgisk avdeling ; Klinikk for kirurgi, nevrologi og rehabilitering ; Helse Stavanger HF ; Helse Vest RHF";;FVH utført av leverandør, se vedlegg.;0,00;0,00;"Kirurgisk gastropol ; Gastroenterologisk kirurgisk avdeling ; Klinikk for kirurgi, nevrologi og rehabilitering ; Helse Stavanger HF ; Helse Vest RHF";;;;;;;;;;;;;;;;;;;;;;;;;;;;;
HST180209;Normal/Akutt;"Pasient på 80 år fikk strøm i seg under et inngrep.
Utstyr med tilbehør ble tatt ut av produksjon for undersøkelse.";014052;Diatermi, universal, komplett;ESG-100;12.10.2021;;;;15.01.2018;20.02.2018;Bjarte Nærland (nebj);Meldt Statens Legemiddelverk 15. jan. 2018. Ble brukt feil modus på diatermi apparatet som førte til muskel sammentrekning.;"Avdeling for medisinsk teknologi og informatikk ; Klinikk for medisinsk teknologi ; Helse Stavanger HF ; Helse Vest RHF";;114271;"Gastroenterologisk kirurgisk avdeling ; Klinikk for kirurgi, nevrologi og rehabilitering ; Helse Stavanger HF ; Helse Vest RHF";;;0,00;0,00;"Kirurgisk gastropol ; Gastroenterologisk kirurgisk avdeling ; Klinikk for kirurgi, nevrologi og rehabilitering ; Helse Stavanger HF ; Helse Vest RHF";;;;;;;;;;;;;;;;;;;;;;;;;;;;;
HST180213;PV;FVH.;010027;Diatermi, universal, komplett;UES-40;31.10.2017;;;;01.10.2017;31.10.2017;Bjarte Nærland (nebj);FVH utført av leverandør, se vedlegg.;"Avdeling for medisinsk teknologi og informatikk ; Klinikk for medisinsk teknologi ; Helse Stavanger HF ; Helse Vest RHF";;114291;"Operasjonsavdeling ; Klinikk A ; Helse Stavanger HF ; Helse Vest RHF";;FVH utført av leverandør, se vedlegg.;0,00;0,00;"Dagkirurgi SYD ; Operasjonsavdeling ; Klinikk A ; Helse Stavanger HF ; Helse Vest RHF";;;;;;;;;;;;;;;;;;;;;;;;;;;;;
HST180228;PV;FVH.;016968;Diatermi, universal, komplett;ESG-100;08.03.2024;;;;01.10.2017;30.10.2017;Bjarte Nærland (nebj);FVH utført av leverandør, se vedlegg.;"Med. gastro poliklinikk ; Gastroseksjon ; Medisinsk avdeling ; Mottaksklinikken ; Helse Stavanger HF ; Helse Vest RHF";;114271;"Gastroenterologisk kirurgisk avdeling ; Klinikk for kirurgi, nevrologi og rehabilitering ; Helse Stavanger HF ; Helse Vest RHF";;FVH utført av leverandør, se vedlegg.;0,00;0,00;"Kirurgisk gastropol ; Gastroenterologisk kirurgisk avdeling ; Klinikk for kirurgi, nevrologi og rehabilitering ; Helse Stavanger HF ; Helse Vest RHF";;;;;;;;;;;;;;;;;;;;;;;;;;;;;
HST180232;PV;FVH.;010623;Diatermi, endoskopisk, komplett;PSD-60;07.10.2019;;;;01.10.2017;31.10.2017;Bjarte Nærland (nebj);FVH utført av leverandør, se vedlegg.;"Avdeling for medisinsk teknologi og informatikk ; Klinikk for medisinsk teknologi ; Helse Stavanger HF ; Helse Vest RHF";;114271;"Gastroenterologisk kirurgisk avdeling ; Klinikk for kirurgi, nevrologi og rehabilitering ; Helse Stavanger HF ; Helse Vest RHF";;FVH utført av leverandør, se vedlegg.;0,00;0,00;"MTI Avd. for med. teknologi og informatikk ; Avdeling for medisinsk teknologi og informatikk ; Klinikk for medisinsk teknologi ; Helse Stavanger HF ; Helse Vest RHF";;;;;;;;;;;;;;;;;;;;;;;;;;;;;
