AO-nr.;AO-type;Oppgave/feilbeskrivelse;Reg.nr.;Utstyrsgruppe;Modell;Seneste PV;Neste PV;Oppdatert;Oppdatert av Sign;Reg. dato;Ferdig;Sign;Teknisk beskrivelse;Plassering (utstyr);Gruppe;Kundekode;Kunde;Sak;Kundetekst;Totalt;Nedetid;Plassering;;;;;;;;;;;;;;;;;;;;;;;;;;;;;
HST013382;Normal/Akutt;Err. 45 - periodisk;004031;Diatermi, universal, komplett;10128;;;;;29.11.2004;03.12.2004;* Kari Ada MELING-JAKOBSEN (KAM);Skiftet control board, - Kalibrert, - Funksjon og sikkerhetstestet;"Kassasjon ;  ;  ; Avdeling for medisinsk teknologi og informatikk ; Klinikk for Medisinsk teknologi ; Helse Stavanger HF ; Helse Vest RHF";;4204466;"Sentraloperasjon 1 ; Operasjonsavdeling ; Klinikk A ; Helse Stavanger HF ; Helse Vest RHF";;;800,00;96,00;"Kassasjon ;  ;  ; Avdeling for medisinsk teknologi og informatikk ; Klinikk for Medisinsk teknologi ; Helse Stavanger HF ; Helse Vest RHF";;;;;;;;;;;;;;;;;;;;;;;;;;;;;
HST013383;Normal/Akutt;Ustabil nessy - Krets;006717;Diatermi, universal, komplett;10128-009;07.04.2014;;;;04.11.2004;03.12.2004;Morten Ruud (rumo);"Feilsøking - ingen feil funnet - Sjekket kalibrering - Testet  OK
Har prøvd å bytte TP9 uten at det  hjalp";"MTI MU som venter på omplassering ;  ;  ; Avdeling for medisinsk teknologi og informatikk ; Klinikk for Medisinsk teknologi ; Helse Stavanger HF ; Helse Vest RHF";;114301;"Gynekologisk poliklinikk ; Avdeling Kvinneklinikken ; Kvinne- og barneklinikken ; Helse Stavanger HF ; Helse Vest RHF";;;400,00;695,43;"MTI MU som venter på omplassering ;  ;  ; Avdeling for medisinsk teknologi og informatikk ; Klinikk for Medisinsk teknologi ; Helse Stavanger HF ; Helse Vest RHF";;;;;;;;;;;;;;;;;;;;;;;;;;;;;
HST013449;Normal/Akutt;Kommer opp error på display, lyser rødt.;004396;Diatermi, universal, komplett;10128;;;;;07.12.2004;22.12.2004;Morten Ruud (rumo);"Testet uten å finne feil.
Error log:50, 24, 1, 46, 47, 30, 48, 21, 20";"Kassasjon ;  ;  ; Avdeling for medisinsk teknologi og informatikk ; Klinikk for Medisinsk teknologi ; Helse Stavanger HF ; Helse Vest RHF";;114393;"Dagkirurgi SYD ; Operasjonsavdeling ; Klinikk A ; Helse Stavanger HF ; Helse Vest RHF";;;400,00;360,15;"Kassasjon ;  ;  ; Avdeling for medisinsk teknologi og informatikk ; Klinikk for Medisinsk teknologi ; Helse Stavanger HF ; Helse Vest RHF";;;;;;;;;;;;;;;;;;;;;;;;;;;;;
HST013500;Normal/Akutt;Feilmeldinger;004394;Diatermi, universal, komplett;10128;;;;;04.01.2005;04.01.2005;Morten Ruud (rumo);Byttet kabel i fotpedal.;"Kassasjon ;  ;  ; Avdeling for medisinsk teknologi og informatikk ; Klinikk for Medisinsk teknologi ; Helse Stavanger HF ; Helse Vest RHF";;114393;"Dagkirurgi SYD ; Operasjonsavdeling ; Klinikk A ; Helse Stavanger HF ; Helse Vest RHF";;;600,00;0,00;"Kassasjon ;  ;  ; Avdeling for medisinsk teknologi og informatikk ; Klinikk for Medisinsk teknologi ; Helse Stavanger HF ; Helse Vest RHF";;;;;;;;;;;;;;;;;;;;;;;;;;;;;
HST013613;Normal/Akutt;Apparatet virker og så virker det ikke når det er skrudd på;004029;Diatermi, universal, komplett;10128;18.04.2000;;;;20.01.2005;01.02.2005;Morten Ruud (rumo);"Sjekket uten å finne feil
ROA har også sjekket det.
Sender det opp igjen.";"Kassasjon ;  ;  ; Avdeling for medisinsk teknologi og informatikk ; Klinikk for Medisinsk teknologi ; Helse Stavanger HF ; Helse Vest RHF";;4204466;"Sentraloperasjon 1 ; Operasjonsavdeling ; Klinikk A ; Helse Stavanger HF ; Helse Vest RHF";;;0,00;288,03;"Kassasjon ;  ;  ; Avdeling for medisinsk teknologi og informatikk ; Klinikk for Medisinsk teknologi ; Helse Stavanger HF ; Helse Vest RHF";;;;;;;;;;;;;;;;;;;;;;;;;;;;;
HST013696;Normal/Akutt;Fungerer ikke på batteri særlig lenge.;008479;Diatermi, universal, komplett;10128-009;25.01.2024;24.01.2025;;;24.02.2005;25.02.2005;Rune Aalberg (aaruau);Ladet over natten. Avd. prøver og ser at app. fungerer tilfredsstillende på batteri.;"Eigersund poliklinikk ; Medisinsk avdeling ; Mottaksklinikken ; Helse Stavanger HF ; Helse Vest RHF";;38;"Eigersund kirurgisk pol. ; Helse Stavanger HF ; Helse Vest RHF";;;0,00;20,07;"Eigersund poliklinikk ; Medisinsk avdeling ; Mottaksklinikken ; Helse Stavanger HF ; Helse Vest RHF";;;;;;;;;;;;;;;;;;;;;;;;;;;;;
HST013859;Normal/Akutt;Lyser ikke grønt ved tilkobling av nøytralplate.  (ledning OK)Støpsel er og ødelagt.;005579;Diatermi, universal, komplett;10128-032;04.02.2015;;;;13.04.2005;13.04.2005;Morten Ruud (rumo);Ingen feil funnet.  Byttet kontakt.;"Sentraloperasjon 1 ; Operasjonsavdeling ; Klinikk A ; Helse Stavanger HF ; Helse Vest RHF";;4204466;"Sentraloperasjon 1 ; Operasjonsavdeling ; Klinikk A ; Helse Stavanger HF ; Helse Vest RHF";;;0,00;0,02;"Sentraloperasjon 1 ; Operasjonsavdeling ; Klinikk A ; Helse Stavanger HF ; Helse Vest RHF";;;;;;;;;;;;;;;;;;;;;;;;;;;;;
HST014100;Normal/Akutt;Pedal tilsølt med blod.;008795;Diatermi, universal, komplett;360080-01;27.02.2024;;;;12.07.2005;13.07.2005;Torstein Bore (bort);"Vasket pedal med sprit. 
Skiftet o-ring til lokk.";"Øre- nese- hals poliklinikk ; Øre- nese- hals avdeling ; Klinikk for kirurgi, nevrologi og rehabilitering ; Helse Stavanger HF ; Helse Vest RHF";;105454;"Øre- nese- hals poliklinikk ; Øre- nese- hals avdeling ; Klinikk for kirurgi, nevrologi og rehabilitering ; Helse Stavanger HF ; Helse Vest RHF";;;400,00;0,00;"Øre- nese- hals poliklinikk ; Øre- nese- hals avdeling ; Klinikk for kirurgi, nevrologi og rehabilitering ; Helse Stavanger HF ; Helse Vest RHF";;;;;;;;;;;;;;;;;;;;;;;;;;;;;
HST014261;Normal/Akutt;Strømløst.;004032;Diatermi, universal, komplett;10128;;;;;06.09.2005;06.09.2005;Morten Ruud (rumo);Byttet nettledning til tralle. #ØØ%Ø&&#%Ø#;"Kassasjon ;  ;  ; Avdeling for medisinsk teknologi og informatikk ; Klinikk for Medisinsk teknologi ; Helse Stavanger HF ; Helse Vest RHF";;4204466;"Sentraloperasjon 1 ; Operasjonsavdeling ; Klinikk A ; Helse Stavanger HF ; Helse Vest RHF";;;1 600,00;0,00;"Kassasjon ;  ;  ; Avdeling for medisinsk teknologi og informatikk ; Klinikk for Medisinsk teknologi ; Helse Stavanger HF ; Helse Vest RHF";;;;;;;;;;;;;;;;;;;;;;;;;;;;;
HST014282;Normal/Akutt;oppgradering.;009350;Diatermi, universal, komplett;ME 402;01.02.2024;;;;13.09.2005;12.10.2005;Morten Ruud (rumo);"DMA:
Skiftet sokler for bipolar og nøytralplate,  Testet.
Garanti/Oppgradering.";"RAD SYD Lab 02 ; Sjefradiograf ; Avdeling for radiologi ; Klinikk for Medisinsk service og ABK ; Helse Stavanger HF ; Helse Vest RHF";;4204466;"Sentraloperasjon 1 ; Operasjonsavdeling ; Klinikk A ; Helse Stavanger HF ; Helse Vest RHF";;;0,00;696,02;"Sentraloperasjon 1 ; Operasjonsavdeling ; Klinikk A ; Helse Stavanger HF ; Helse Vest RHF";;;;;;;;;;;;;;;;;;;;;;;;;;;;;
HST014377;Normal/Akutt;Problemer med NE-kontakt.;004397;Diatermi, universal, komplett;10128;;;;;25.10.2005;25.10.2005;Morten Ruud (rumo);Testet og kontrollert kalibrering.  Fant ingen feil, og sendte det opp igjen;"Kassasjon ;  ;  ; Avdeling for medisinsk teknologi og informatikk ; Klinikk for Medisinsk teknologi ; Helse Stavanger HF ; Helse Vest RHF";;114393;"Dagkirurgi SYD ; Operasjonsavdeling ; Klinikk A ; Helse Stavanger HF ; Helse Vest RHF";;;600,00;0,00;"Kassasjon ;  ;  ; Avdeling for medisinsk teknologi og informatikk ; Klinikk for Medisinsk teknologi ; Helse Stavanger HF ; Helse Vest RHF";;;;;;;;;;;;;;;;;;;;;;;;;;;;;
HST014422;Normal/Akutt;Apparatet alarmere.;009561;Diatermi, universal, komplett;LigaSure;12.02.2013;;;;14.11.2005;14.11.2005;Morten Ruud (rumo);Defekt rele.;"Sentraloperasjon 1 ; Operasjonsavdeling ; Klinikk A ; Helse Stavanger HF ; Helse Vest RHF";;4204466;"Sentraloperasjon 1 ; Operasjonsavdeling ; Klinikk A ; Helse Stavanger HF ; Helse Vest RHF";;;200,00;0,02;"Sentraloperasjon 1 ; Operasjonsavdeling ; Klinikk A ; Helse Stavanger HF ; Helse Vest RHF";;;;;;;;;;;;;;;;;;;;;;;;;;;;;
HST014678;Normal/Akutt;Selger fra Tyco er innom og tar med seg apparatet på service. 10/2-06.;009561;Diatermi, universal, komplett;LigaSure;12.02.2013;;;;10.02.2006;17.02.2006;*  (hsti);Tilbake fra rep 17/2-06.;"Sentraloperasjon 1 ; Operasjonsavdeling ; Klinikk A ; Helse Stavanger HF ; Helse Vest RHF";;4204466;"Sentraloperasjon 1 ; Operasjonsavdeling ; Klinikk A ; Helse Stavanger HF ; Helse Vest RHF";;;0,00;0,00;"Sentraloperasjon 1 ; Operasjonsavdeling ; Klinikk A ; Helse Stavanger HF ; Helse Vest RHF";;;;;;;;;;;;;;;;;;;;;;;;;;;;;
HST015192;Normal/Akutt;Kan ikke stille auto bipolar på 1.;004397;Diatermi, universal, komplett;10128;;;;;26.09.2006;26.09.2006;Morten Ruud (rumo);Sjekket uten å finne feil.;"Kassasjon ;  ;  ; Avdeling for medisinsk teknologi og informatikk ; Klinikk for Medisinsk teknologi ; Helse Stavanger HF ; Helse Vest RHF";;114393;"Dagkirurgi SYD ; Operasjonsavdeling ; Klinikk A ; Helse Stavanger HF ; Helse Vest RHF";;;0,00;0,02;"Kassasjon ;  ;  ; Avdeling for medisinsk teknologi og informatikk ; Klinikk for Medisinsk teknologi ; Helse Stavanger HF ; Helse Vest RHF";;;;;;;;;;;;;;;;;;;;;;;;;;;;;
HST015358;Normal/Akutt;Blinker hvitt lys på utgangene når vi slår på apparatet,  Det kommer ikke videre i selvtest;009575;Diatermi, universal, komplett;ME 402;15.02.2023;;;;15.11.2006;15.11.2006;Morten Ruud (rumo);Kontrollert funksjon.  Observerte blinking en gang, uten at det hadde noen andre konsekvenser.  Testet  og sikkerhetstestet.  OK.;"Avdeling for medisinsk teknologi og informatikk ; Klinikk for medisinsk teknologi ; Helse Stavanger HF ; Helse Vest RHF";;4204466;"Sentraloperasjon 1 ; Operasjonsavdeling ; Klinikk A ; Helse Stavanger HF ; Helse Vest RHF";;;600,00;0,02;"Sentraloperasjon 1 ; Operasjonsavdeling ; Klinikk A ; Helse Stavanger HF ; Helse Vest RHF";;;;;;;;;;;;;;;;;;;;;;;;;;;;;
HST015359;Normal/Akutt;Apparatet falt i gulvet.  Innstillingsratt falt av.;009572;Diatermi, universal, komplett;ME 402;21.08.2024;15.03.2025;;;15.11.2006;15.11.2006;Morten Ruud (rumo);Byttet innstillingsratt.  testet og sikkerhetstestet.  OK;"Sentraloperasjon 1 ; Operasjonsavdeling ; Klinikk A ; Helse Stavanger HF ; Helse Vest RHF";;4204466;"Sentraloperasjon 1 ; Operasjonsavdeling ; Klinikk A ; Helse Stavanger HF ; Helse Vest RHF";;;600,00;0,02;"Sentraloperasjon 1 ; Operasjonsavdeling ; Klinikk A ; Helse Stavanger HF ; Helse Vest RHF";;;;;;;;;;;;;;;;;;;;;;;;;;;;;
HST015448;Normal/Akutt;Registrert rykninger i pasient ved laparaskopisk inngrep.;009573;Diatermi, universal, komplett;ME 402;21.08.2024;28.03.2025;;;18.12.2006;21.12.2006;Morten Ruud (rumo);"Sjekket funksjon: OK 
 Automatisk lekkstrømsmåling OK  
Manuell måling ga pas.lekkstrøm på 2,1uA (normal) og 2,8uA (åpen jord).  Mains on applied ga 14,4 uA.  Alt innenfor grensene.
Sender tilbake til brukerne.";"Sentraloperasjon 1 ; Operasjonsavdeling ; Klinikk A ; Helse Stavanger HF ; Helse Vest RHF";;4204466;"Sentraloperasjon 1 ; Operasjonsavdeling ; Klinikk A ; Helse Stavanger HF ; Helse Vest RHF";;;0,00;72,10;"Sentraloperasjon 1 ; Operasjonsavdeling ; Klinikk A ; Helse Stavanger HF ; Helse Vest RHF";;;;;;;;;;;;;;;;;;;;;;;;;;;;;
HST015638;Normal/Akutt;Blinker med lysene på utgangen.  Ingen effekt ut.;009575;Diatermi, universal, komplett;ME 402;15.02.2023;;;;27.12.2006;02.03.2007;Morten Ruud (rumo);Byttet deler.  Testet og Eltestet:  OK;"Avdeling for medisinsk teknologi og informatikk ; Klinikk for medisinsk teknologi ; Helse Stavanger HF ; Helse Vest RHF";;4204466;"Sentraloperasjon 1 ; Operasjonsavdeling ; Klinikk A ; Helse Stavanger HF ; Helse Vest RHF";;;600,00;1 560,03;"Sentraloperasjon 1 ; Operasjonsavdeling ; Klinikk A ; Helse Stavanger HF ; Helse Vest RHF";;;;;;;;;;;;;;;;;;;;;;;;;;;;;
HST015650;Normal/Akutt;Virker ikke.  Periodisk.;008795;Diatermi, universal, komplett;360080-01;27.02.2024;;;;05.03.2007;05.03.2007;Morten Ruud (rumo);Sjekket uten å finne feil.  Åpnet for å se etter dårlige kontakter etc.  Alt så greit ut.;"Øre- nese- hals poliklinikk ; Øre- nese- hals avdeling ; Klinikk for kirurgi, nevrologi og rehabilitering ; Helse Stavanger HF ; Helse Vest RHF";;105454;"Øre- nese- hals poliklinikk ; Øre- nese- hals avdeling ; Klinikk for kirurgi, nevrologi og rehabilitering ; Helse Stavanger HF ; Helse Vest RHF";;;200,00;0,00;"Øre- nese- hals poliklinikk ; Øre- nese- hals avdeling ; Klinikk for kirurgi, nevrologi og rehabilitering ; Helse Stavanger HF ; Helse Vest RHF";;;;;;;;;;;;;;;;;;;;;;;;;;;;;
HST015816;Normal/Akutt;Slår seg på de setter i støpsel, får ikke slått av uten uten å dra ut støpselet igjen.;009554;Diatermi, universal, komplett;ME 402;31.01.2023;;;;03.04.2007;03.04.2007;Endre Larsen Skåren (LAENAN);Åpner opp apparatet, trykker inn resetknappen. (Mikroknapp på kortet som står opp midt i apparatet, S1) Da resettes software og det fungerer igjen.;"Sentraloperasjon 1 ; Operasjonsavdeling ; Klinikk A ; Helse Stavanger HF ; Helse Vest RHF";;4204466;"Sentraloperasjon 1 ; Operasjonsavdeling ; Klinikk A ; Helse Stavanger HF ; Helse Vest RHF";;;400,00;0,00;"Sentraloperasjon 1 ; Operasjonsavdeling ; Klinikk A ; Helse Stavanger HF ; Helse Vest RHF";;;;;;;;;;;;;;;;;;;;;;;;;;;;;
HST015969;Normal/Akutt;Får ikke slått av apparatet.;009554;Diatermi, universal, komplett;ME 402;31.01.2023;;;;22.05.2007;22.05.2007;Endre Larsen Skåren (LAENAN);Åpner opp og resetter power supply controller. Nå har dette skjedd to ganger. Ringer Oddmund i DMA for å høre om vi bør gjøre noe mer.;"Sentraloperasjon 1 ; Operasjonsavdeling ; Klinikk A ; Helse Stavanger HF ; Helse Vest RHF";;4204466;"Sentraloperasjon 1 ; Operasjonsavdeling ; Klinikk A ; Helse Stavanger HF ; Helse Vest RHF";;;400,00;0,00;"Sentraloperasjon 1 ; Operasjonsavdeling ; Klinikk A ; Helse Stavanger HF ; Helse Vest RHF";;;;;;;;;;;;;;;;;;;;;;;;;;;;;
HST016007;Normal/Akutt;"Ikke effekt ut på bipolar.
I tillegg kommer det blå lyset på som indikerer at coag er aktivert;  ingen lyd.";009350;Diatermi, universal, komplett;ME 402;01.02.2024;;;;01.06.2007;01.06.2007;Rune Otto Andreassen (ANRO);Testet. og latt stå på i lang tid (dager) uten at feilen har dukket opp.  Sendt tilbake til brukerne, og bedt de sjekke kabler og pinsetter ved feil.  i tilllegg trenger de mer opplæring iflg. de selv;"RAD SYD Lab 02 ; Sjefradiograf ; Avdeling for radiologi ; Klinikk for Medisinsk service og ABK ; Helse Stavanger HF ; Helse Vest RHF";;4204466;"Sentraloperasjon 1 ; Operasjonsavdeling ; Klinikk A ; Helse Stavanger HF ; Helse Vest RHF";;;0,00;0,02;"Sentraloperasjon 1 ; Operasjonsavdeling ; Klinikk A ; Helse Stavanger HF ; Helse Vest RHF";;;;;;;;;;;;;;;;;;;;;;;;;;;;;
HST070547;Normal/Akutt;Skal inn til DMA for oppgradering pga problemer med hang up i det siste. Låneapparat 1105 er sendt opp til avdling.;009554;Diatermi, universal, komplett;ME 402;31.01.2023;;;;04.06.2007;27.07.2007;Endre Larsen Skåren (LAENAN);"Påbegynt 04/06/07 av EL.

24/07-Returnert fra DMA, changed control element/display component.";"Sentraloperasjon 1 ; Operasjonsavdeling ; Klinikk A ; Helse Stavanger HF ; Helse Vest RHF";;114291;"Operasjonsavdeling ; Klinikk A ; Helse Stavanger HF ; Helse Vest RHF";;;0,00;0,00;"Sentraloperasjon 1 ; Operasjonsavdeling ; Klinikk A ; Helse Stavanger HF ; Helse Vest RHF";;;;;;;;;;;;;;;;;;;;;;;;;;;;;
HST070602;Normal/Akutt;Dødt apparat;009577;Diatermi, universal, komplett;ME 402;28.02.2023;;;;20.06.2007;20.06.2007;Endre Larsen Skåren (LAENAN);Målt innspenning til 67V, byttet tilførselsledning-OK;"Avdeling for medisinsk teknologi og informatikk ; Klinikk for medisinsk teknologi ; Helse Stavanger HF ; Helse Vest RHF";;114291;"Operasjonsavdeling ; Klinikk A ; Helse Stavanger HF ; Helse Vest RHF";;;312,50;0,00;"Sentraloperasjon 1 ; Operasjonsavdeling ; Klinikk A ; Helse Stavanger HF ; Helse Vest RHF";;;;;;;;;;;;;;;;;;;;;;;;;;;;;
HST070672;Normal/Akutt;Virker annenhver gang.;005936;Diatermi, universal, komplett;10122-041;17.01.2024;22.02.2025;;;03.07.2007;03.07.2007;Morten Ruud (rumo);Ingen feil funnet.;"Hudpoliklinikken ; Hudavdeling ; Klinikk for kirurgi, nevrologi og rehabilitering ; Helse Stavanger HF ; Helse Vest RHF";;114394;"Poliklinikk kirurgisk 4E ; Kar/thorax kirurgisk seksjon ; Kirurgisk avdeling ; Klinikk for kirurgi, nevrologi og rehabilitering ; Helse Stavanger HF ; Helse Vest RHF";;;0,00;0,00;"Hudpoliklinikken ; Hudavdeling ; Klinikk for kirurgi, nevrologi og rehabilitering ; Helse Stavanger HF ; Helse Vest RHF";;;;;;;;;;;;;;;;;;;;;;;;;;;;;
HST070800;Normal/Akutt;Oppgradering til versjon 2.0;009558;Diatermi, universal, komplett;UES-40;12.03.2024;;;;06.08.2007;06.08.2007;Morten Ruud (rumo);Oppgradering til versjon 2.0;"Operasjon DK ; Dagkirurgi Hillevåg ; Klinikk A ; Helse Stavanger HF ; Helse Vest RHF";;114291;"Operasjonsavdeling ; Klinikk A ; Helse Stavanger HF ; Helse Vest RHF";;;0,00;0,00;"Sentraloperasjon 1 ; Operasjonsavdeling ; Klinikk A ; Helse Stavanger HF ; Helse Vest RHF";;;;;;;;;;;;;;;;;;;;;;;;;;;;;
HST070801;Normal/Akutt;Oppgradering til versjon 2.0;010027;Diatermi, universal, komplett;UES-40;31.10.2017;;;;06.08.2007;06.08.2007;Morten Ruud (rumo);Oppgradering til versjon 2.0;"Avdeling for medisinsk teknologi og informatikk ; Klinikk for medisinsk teknologi ; Helse Stavanger HF ; Helse Vest RHF";;114291;"Operasjonsavdeling ; Klinikk A ; Helse Stavanger HF ; Helse Vest RHF";;;0,00;0,00;"Dagkirurgi SYD ; Operasjonsavdeling ; Klinikk A ; Helse Stavanger HF ; Helse Vest RHF";;;;;;;;;;;;;;;;;;;;;;;;;;;;;
HST070802;Normal/Akutt;Oppgradering til versjon 2.0;009556;Diatermi, universal, komplett;UES-40;26.10.2021;;;;06.08.2007;06.08.2007;Morten Ruud (rumo);Oppgradering til versjon 2.0;"KK operasjon ; Avdeling Kvinneklinikken ; Kvinne- og barneklinikken ; Helse Stavanger HF ; Helse Vest RHF";;114291;"Operasjonsavdeling ; Klinikk A ; Helse Stavanger HF ; Helse Vest RHF";;;0,00;0,00;"Sentraloperasjon 1 ; Operasjonsavdeling ; Klinikk A ; Helse Stavanger HF ; Helse Vest RHF";;;;;;;;;;;;;;;;;;;;;;;;;;;;;
HST070803;Normal/Akutt;Oppgradering til versjon 2.0;009557;Diatermi, universal, komplett;UES-40;27.10.2021;;;;06.08.2007;06.08.2007;Morten Ruud (rumo);Oppgradering til versjon 2.0;"Sentraloperasjon 1 ; Operasjonsavdeling ; Klinikk A ; Helse Stavanger HF ; Helse Vest RHF";;114291;"Operasjonsavdeling ; Klinikk A ; Helse Stavanger HF ; Helse Vest RHF";;;0,00;0,00;"Sentraloperasjon 1 ; Operasjonsavdeling ; Klinikk A ; Helse Stavanger HF ; Helse Vest RHF";;;;;;;;;;;;;;;;;;;;;;;;;;;;;
HST070967;Normal/Akutt;"Brukerne sier at det ikke virker, selvom de har byttet ledningo g pinsetter 3 ganger.
";005510;Diatermi, universal, komplett;10122-041;12.02.2013;;;;26.09.2007;26.09.2007;Morten Ruud (rumo);Ingen feil funnet.;"Operasjon Øst ; Operasjonsavdeling ; Klinikk A ; Helse Stavanger HF ; Helse Vest RHF";;4204458;"Operasjon Øst ; Operasjonsavdeling ; Klinikk A ; Helse Stavanger HF ; Helse Vest RHF";;;0,00;0,00;"Operasjon Øst ; Operasjonsavdeling ; Klinikk A ; Helse Stavanger HF ; Helse Vest RHF";;;;;;;;;;;;;;;;;;;;;;;;;;;;;
HST080320;Normal/Akutt;Virker ikke alltid ved aktivering.;006717;Diatermi, universal, komplett;10128-009;07.04.2014;;;;31.03.2008;25.04.2008;Morten Ruud (rumo);"Feil verifisert av MTI:
Feilmelding 7 rapportert, og ser at den ikke alltid aktiverer bipolar (med forskjellige pedaler)
Rep. av Puls:  Byttet senso-board, kalibrert og testet.  El.testet.
OK";"MTI MU som venter på omplassering ;  ;  ; Avdeling for medisinsk teknologi og informatikk ; Klinikk for Medisinsk teknologi ; Helse Stavanger HF ; Helse Vest RHF";;114302;"Fostermedisinsk poliklinikk ; Avdeling Kvinneklinikken ; Kvinne- og barneklinikken ; Helse Stavanger HF ; Helse Vest RHF";;;0,00;0,00;"MTI MU som venter på omplassering ;  ;  ; Avdeling for medisinsk teknologi og informatikk ; Klinikk for Medisinsk teknologi ; Helse Stavanger HF ; Helse Vest RHF";;;;;;;;;;;;;;;;;;;;;;;;;;;;;
HST080322;Normal/Akutt;Falt i gulvet.;008795;Diatermi, universal, komplett;360080-01;27.02.2024;;;;01.04.2008;01.04.2008;Morten Ruud (rumo);Byttet nettilkobling bak.  Rettet ut frontpanel.  Testet for funksjon og effekt.  El. sikkerhetstest.  OK;"Øre- nese- hals poliklinikk ; Øre- nese- hals avdeling ; Klinikk for kirurgi, nevrologi og rehabilitering ; Helse Stavanger HF ; Helse Vest RHF";;105418;"Øre- nese- hals avdeling ; Klinikk for kirurgi, nevrologi og rehabilitering ; Helse Stavanger HF ; Helse Vest RHF";;;0,00;0,00;"Øre- nese- hals poliklinikk ; Øre- nese- hals avdeling ; Klinikk for kirurgi, nevrologi og rehabilitering ; Helse Stavanger HF ; Helse Vest RHF";;;;;;;;;;;;;;;;;;;;;;;;;;;;;
HST080467;Normal/Akutt;Får ikke alltid aktivert Coag, og noen ganger kommer Cut isteden.;006717;Diatermi, universal, komplett;10128-009;07.04.2014;;;;02.05.2008;19.05.2008;Morten Ruud (rumo);"Verifisert feil.
Virker OK med Erbe-penn (den har diodene som forteller apparatet om hva den skal aktivere innebygd.)
Byttet mono output board; det var brente komponenter på den.
Testet OK.";"MTI MU som venter på omplassering ;  ;  ; Avdeling for medisinsk teknologi og informatikk ; Klinikk for Medisinsk teknologi ; Helse Stavanger HF ; Helse Vest RHF";;114302;"Fostermedisinsk poliklinikk ; Avdeling Kvinneklinikken ; Kvinne- og barneklinikken ; Helse Stavanger HF ; Helse Vest RHF";;;0,00;0,00;"MTI MU som venter på omplassering ;  ;  ; Avdeling for medisinsk teknologi og informatikk ; Klinikk for Medisinsk teknologi ; Helse Stavanger HF ; Helse Vest RHF";;;;;;;;;;;;;;;;;;;;;;;;;;;;;
HST080523;Normal/Akutt;Har falt i gulvet.....;008348;Diatermi, universal, komplett;RSC2007-230;12.02.2013;;;;28.05.2008;08.01.2009;Morten Ruud (rumo);"Bestillt låneapparat; sender så inn til reparasjon.

Vi har beholdt låneapparatet , og betalt mellomlegg på ca. 60000,- inkl mva.";"Gynekologisk poliklinikk ; Avdeling Kvinneklinikken ; Kvinne- og barneklinikken ; Helse Stavanger HF ; Helse Vest RHF";;114302;"Fostermedisinsk poliklinikk ; Avdeling Kvinneklinikken ; Kvinne- og barneklinikken ; Helse Stavanger HF ; Helse Vest RHF";;;0,00;0,00;"Gynekologisk poliklinikk ; Avdeling Kvinneklinikken ; Kvinne- og barneklinikken ; Helse Stavanger HF ; Helse Vest RHF";;;;;;;;;;;;;;;;;;;;;;;;;;;;;
HST080606;Normal/Akutt;Error 7:  Dobbeltaktivering. ved Cut;005511;Diatermi, universal, komplett;10122-041;20.01.2015;;;;23.06.2008;23.06.2008;Morten Ruud (rumo);"Ved bruk av erbe-penn virket alt som det skulle.  Valleylab-penn ga feil ved forsøk på aktivering av Cut
Endre Larsen har under kyndig veilening av undertegnede byttet diodene som står på den aktive utgangen. 
Alt virket da som det skulle.  Selvsagt!";"Eigersund poliklinikk ; Medisinsk avdeling ; Mottaksklinikken ; Helse Stavanger HF ; Helse Vest RHF";;4204458;"Operasjon Øst ; Operasjonsavdeling ; Klinikk A ; Helse Stavanger HF ; Helse Vest RHF";;;0,00;0,00;"Eigersund poliklinikk ; Medisinsk avdeling ; Mottaksklinikken ; Helse Stavanger HF ; Helse Vest RHF";;;;;;;;;;;;;;;;;;;;;;;;;;;;;
HST080628;Normal/Akutt;Feil på en monopolar utgang;009570;Diatermi, universal, komplett;ME 402;28.02.2023;;;;30.06.2008;30.06.2008;Endre Larsen Skåren (LAENAN);Byttet monopolar PCB, testet utganger OK. Kjørt el-test.;"Avdeling for medisinsk teknologi og informatikk ; Klinikk for medisinsk teknologi ; Helse Stavanger HF ; Helse Vest RHF";;114291;"Operasjonsavdeling ; Klinikk A ; Helse Stavanger HF ; Helse Vest RHF";;;1 250,00;0,00;"Sentraloperasjon 1 ; Operasjonsavdeling ; Klinikk A ; Helse Stavanger HF ; Helse Vest RHF";;;;;;;;;;;;;;;;;;;;;;;;;;;;;
HST080819;Normal/Akutt;Feilmelding -F;006790;Diatermi, universal, komplett;7-900-230;12.02.2013;;;;27.08.2008;27.08.2008;Endre Larsen Skåren (LAENAN);Tone not detected during activation. Sjekket servicemanual fant  feilmelding. Satte apparatet i Service PR mode. Satte det tilbake i normal mode og feilen var borte. Kontrollerte levert effekt- OK. Retur avdl.;"Kassasjon ;  ;  ; Avdeling for medisinsk teknologi og informatikk ; Klinikk for Medisinsk teknologi ; Helse Stavanger HF ; Helse Vest RHF";;105490;"Hudpoliklinikken ; Hudavdeling ; Klinikk for kirurgi, nevrologi og rehabilitering ; Helse Stavanger HF ; Helse Vest RHF";;;937,50;0,00;"Kassasjon ;  ;  ; Avdeling for medisinsk teknologi og informatikk ; Klinikk for Medisinsk teknologi ; Helse Stavanger HF ; Helse Vest RHF";;;;;;;;;;;;;;;;;;;;;;;;;;;;;
HST080898;Normal/Akutt;Kontakt for bipolar løs.;008795;Diatermi, universal, komplett;360080-01;27.02.2024;;;;18.09.2008;18.09.2008;Morten Ruud (rumo);"Åpnet og festet seger-ring som var falt av.
Ser at kontakt for pedal (bak) også har fått seg en smell, men lar den være slik den er.  (Vil trolig være vanskelig å feste igjen , hvis den rettes;  ser heil grei ut.....)

Testet.  OK";"Øre- nese- hals poliklinikk ; Øre- nese- hals avdeling ; Klinikk for kirurgi, nevrologi og rehabilitering ; Helse Stavanger HF ; Helse Vest RHF";;105418;"Øre- nese- hals avdeling ; Klinikk for kirurgi, nevrologi og rehabilitering ; Helse Stavanger HF ; Helse Vest RHF";;;0,00;0,00;"Øre- nese- hals poliklinikk ; Øre- nese- hals avdeling ; Klinikk for kirurgi, nevrologi og rehabilitering ; Helse Stavanger HF ; Helse Vest RHF";;;;;;;;;;;;;;;;;;;;;;;;;;;;;
HST081079;Normal/Akutt;Ble levert med feil utganger.;011496;Diatermi, universal, komplett;ME 402;21.02.2024;28.03.2025;;;18.11.2008;18.11.2008;Morten Ruud (rumo);"Har fått nytt apparat.  Serienr. på det som ble levert 17. 10 .08 var ME402M0603082322

Det nye har også saltvannsTUR";"Operasjon DK ; Dagkirurgi Hillevåg ; Klinikk A ; Helse Stavanger HF ; Helse Vest RHF";;114291;"Operasjonsavdeling ; Klinikk A ; Helse Stavanger HF ; Helse Vest RHF";;;0,00;0,00;"Sentraloperasjon 1 ; Operasjonsavdeling ; Klinikk A ; Helse Stavanger HF ; Helse Vest RHF";;;;;;;;;;;;;;;;;;;;;;;;;;;;;
