AO-nr.;AO-type;Oppgave/feilbeskrivelse;Reg.nr.;Utstyrsgruppe;Modell;Seneste PV;Neste PV;Oppdatert;Oppdatert av Sign;Reg. dato;Ferdig;Sign;Teknisk beskrivelse;Plassering (utstyr);Gruppe;Kundekode;Kunde;Sak;Kundetekst;Totalt;Nedetid;Plassering;;;;;;;;;;;;;;;;;;;;;;;;;;;;;
HST015122;Normal/Akutt;Problemer med FiO2 high.;005777;Ventilator, intensiv, voksen/barn;84 11 740;28.03.2000;;;;21.08.2006;21.08.2006;*  (hsti);Prøvde å kalibrere sensoren, øyeblikksvirningen var da ok. Følg med hvis feilen oppstår kjapt igjen.;"Kassasjon ;  ;  ; Avdeling for medisinsk teknologi og informatikk ; Klinikk for Medisinsk teknologi ; Helse Stavanger HF ; Helse Vest RHF";;4204063;"Intensiv 2M ; Intensivavdelingen ; Klinikk A ; Helse Stavanger HF ; Helse Vest RHF";;;0,00;0,00;"Kassasjon ;  ;  ; Avdeling for medisinsk teknologi og informatikk ; Klinikk for Medisinsk teknologi ; Helse Stavanger HF ; Helse Vest RHF";;;;;;;;;;;;;;;;;;;;;;;;;;;;;
HST015183;Normal/Akutt;Apparatfeil 13.03.001.;005776;Ventilator, intensiv, voksen/barn;84 11 740;;;;;21.09.2006;21.09.2006;*  (hsti);"Defekt CPU kort, har lånt kort fra 5781 i påvente av nytt kort.  
Endte opp med å sette det nye kortet inn i 5781 og la kortet fra 5781 stå i app. 5776.";"Kassasjon ;  ;  ; Avdeling for medisinsk teknologi og informatikk ; Klinikk for Medisinsk teknologi ; Helse Stavanger HF ; Helse Vest RHF";;4204063;"Intensiv 2M ; Intensivavdelingen ; Klinikk A ; Helse Stavanger HF ; Helse Vest RHF";;;0,00;0,02;"Kassasjon ;  ;  ; Avdeling for medisinsk teknologi og informatikk ; Klinikk for Medisinsk teknologi ; Helse Stavanger HF ; Helse Vest RHF";;;;;;;;;;;;;;;;;;;;;;;;;;;;;
HST015193;Normal/Akutt;Brukt til deleplukking.;005781;Ventilator, intensiv, voksen/barn;84 11 740;;;;;26.09.2006;26.09.2006;*  (hsti);"Maskinen har fått nytt CPU kort og ny O2 celle. Det gamle CPU kortet ble satt i app. 5776 for å få denne opp og gå.
Testet ok.";"Intensiv 2M ; Intensivavdelingen ; Klinikk A ; Helse Stavanger HF ; Helse Vest RHF";;4204063;"Intensiv 2M ; Intensivavdelingen ; Klinikk A ; Helse Stavanger HF ; Helse Vest RHF";;;0,00;0,45;"Intensiv 2M ; Intensivavdelingen ; Klinikk A ; Helse Stavanger HF ; Helse Vest RHF";;;;;;;;;;;;;;;;;;;;;;;;;;;;;
HST015342;Normal/Akutt;Fungerer ikke på batteri.;005777;Ventilator, intensiv, voksen/barn;84 11 740;28.03.2000;;;;09.11.2006;09.11.2006;*  (hsti);Det var lekkasje fra det ene batteriet. Har skiftet batteriene, testet ok.;"Kassasjon ;  ;  ; Avdeling for medisinsk teknologi og informatikk ; Klinikk for Medisinsk teknologi ; Helse Stavanger HF ; Helse Vest RHF";;4204063;"Intensiv 2M ; Intensivavdelingen ; Klinikk A ; Helse Stavanger HF ; Helse Vest RHF";;;800,00;0,02;"Kassasjon ;  ;  ; Avdeling for medisinsk teknologi og informatikk ; Klinikk for Medisinsk teknologi ; Helse Stavanger HF ; Helse Vest RHF";;;;;;;;;;;;;;;;;;;;;;;;;;;;;
HST015392;Normal/Akutt;Får ikke tatt apparatkontroll , apparatet hopper tilbake til standby bildet umiddelbart.;005778;Ventilator, intensiv, voksen/barn;84 11 740;;;;;28.11.2006;28.11.2006;*  (hsti);Har ikke klart å finne noe galt med apparatet, feilen var til stede både på avd. og nede på MTA. Etter en del trykking gikk det greit å få tatt apparatkontroll. Maskinen har stått på test over natten, alt ok.;"Kassasjon ;  ;  ; Avdeling for medisinsk teknologi og informatikk ; Klinikk for Medisinsk teknologi ; Helse Stavanger HF ; Helse Vest RHF";;4204063;"Intensiv 2M ; Intensivavdelingen ; Klinikk A ; Helse Stavanger HF ; Helse Vest RHF";;;0,00;0,10;"Kassasjon ;  ;  ; Avdeling for medisinsk teknologi og informatikk ; Klinikk for Medisinsk teknologi ; Helse Stavanger HF ; Helse Vest RHF";;;;;;;;;;;;;;;;;;;;;;;;;;;;;
HST015436;Normal/Akutt;Respiratoren m/ slanger fram til tube ble sjekket mot luftlekkasje: OK! Likevel lekkasje på opptil 8 liter! Hos pas. Lave TV. MV i IPPPV modus leverte ikke respiratoren volumet som var bestilt, tross i høy alarmgrense for PAW.;008567;Ventilator, intensiv, voksen/barn;8414900-07;;;;;11.12.2006;15.12.2006;*  (hsti);"Respiratoren har stått og gått her i tre døgn uten at jeg har fått frem lekkasje. Slanger + tube fra pas. ble flyttet over til annen maskin uten at det var problemer der. 

Setter app. inn i drift og holder den litt under oppsyn.";"Kassasjon ;  ;  ; Avdeling for medisinsk teknologi og informatikk ; Klinikk for Medisinsk teknologi ; Helse Stavanger HF ; Helse Vest RHF";;4204063;"Intensiv 2M ; Intensivavdelingen ; Klinikk A ; Helse Stavanger HF ; Helse Vest RHF";;;0,00;96,03;"Kassasjon ;  ;  ; Avdeling for medisinsk teknologi og informatikk ; Klinikk for Medisinsk teknologi ; Helse Stavanger HF ; Helse Vest RHF";;;;;;;;;;;;;;;;;;;;;;;;;;;;;
HST015447;Normal/Akutt;Får ikke kaliberert O2.;005778;Ventilator, intensiv, voksen/barn;84 11 740;;;;;21.12.2006;21.12.2006;*  (hsti);Har skiftet O2 celle, testet ok med ny celle.;"Kassasjon ;  ;  ; Avdeling for medisinsk teknologi og informatikk ; Klinikk for Medisinsk teknologi ; Helse Stavanger HF ; Helse Vest RHF";;4204063;"Intensiv 2M ; Intensivavdelingen ; Klinikk A ; Helse Stavanger HF ; Helse Vest RHF";;;200,00;0,05;"Kassasjon ;  ;  ; Avdeling for medisinsk teknologi og informatikk ; Klinikk for Medisinsk teknologi ; Helse Stavanger HF ; Helse Vest RHF";;;;;;;;;;;;;;;;;;;;;;;;;;;;;
HST015459;Normal/Akutt;Feilbeskrivelse: Får ikke kalibrert for oksygen;005764;Ventilator, intensiv, voksen/barn;84 11 740;;;;;02.01.2007;02.01.2007;*  (hsti);Byttet oksygencelle;"Kassasjon ;  ;  ; Avdeling for medisinsk teknologi og informatikk ; Klinikk for Medisinsk teknologi ; Helse Stavanger HF ; Helse Vest RHF";;4204063;"Intensiv 2M ; Intensivavdelingen ; Klinikk A ; Helse Stavanger HF ; Helse Vest RHF";;;200,00;0,00;"Kassasjon ;  ;  ; Avdeling for medisinsk teknologi og informatikk ; Klinikk for Medisinsk teknologi ; Helse Stavanger HF ; Helse Vest RHF";;;;;;;;;;;;;;;;;;;;;;;;;;;;;
HST015491;Normal/Akutt;Får ikke config- knappen til å fungere + flimrende skjerm.;005778;Ventilator, intensiv, voksen/barn;84 11 740;;;;;18.01.2007;18.01.2007;*  (hsti);Har skiftet display cpl (bryter panel) + defekt pakning rundt tuch screen og lysrør. Har foretatt 2 års service på app. Har skiftet int. lite batteri + batteripakken. Testet og funnet ok.;"Kassasjon ;  ;  ; Avdeling for medisinsk teknologi og informatikk ; Klinikk for Medisinsk teknologi ; Helse Stavanger HF ; Helse Vest RHF";;4204063;"Intensiv 2M ; Intensivavdelingen ; Klinikk A ; Helse Stavanger HF ; Helse Vest RHF";;;1 600,00;0,05;"Kassasjon ;  ;  ; Avdeling for medisinsk teknologi og informatikk ; Klinikk for Medisinsk teknologi ; Helse Stavanger HF ; Helse Vest RHF";;;;;;;;;;;;;;;;;;;;;;;;;;;;;
HST015493;Normal/Akutt;Får ikke målt O2. Alarmerer på High FiO2.;005779;Ventilator, intensiv, voksen/barn;84 11 740;;;;;19.01.2007;19.01.2007;*  (hsti);Det var et belegg på den gamle cellen, klarer ikke å se hva det er ser ut som en eller annen form for krystaller som har kommet inn i apparatet. Har skiftet O2 celle og tørket vekk de mikroskopiske restene som satt inni apparatet. Har stått til test en hel dag og fungerer ok på O2 måling nå.;"MTI MU mulig kassert ;  ;  ; Avdeling for medisinsk teknologi og informatikk ; Klinikk for Medisinsk teknologi ; Helse Stavanger HF ; Helse Vest RHF";;4204063;"Intensiv 2M ; Intensivavdelingen ; Klinikk A ; Helse Stavanger HF ; Helse Vest RHF";;;800,00;0,02;"MTI MU mulig kassert ;  ;  ; Avdeling for medisinsk teknologi og informatikk ; Klinikk for Medisinsk teknologi ; Helse Stavanger HF ; Helse Vest RHF";;;;;;;;;;;;;;;;;;;;;;;;;;;;;
HST015529;Normal/Akutt;Får ikke kalibrert O2.;005780;Ventilator, intensiv, voksen/barn;84 11 740;;;;;05.02.2007;05.02.2007;*  (hsti);Har skiftet O2 celle, testet ok.;"Kassasjon ;  ;  ; Avdeling for medisinsk teknologi og informatikk ; Klinikk for Medisinsk teknologi ; Helse Stavanger HF ; Helse Vest RHF";;4204063;"Intensiv 2M ; Intensivavdelingen ; Klinikk A ; Helse Stavanger HF ; Helse Vest RHF";;;0,00;0,00;"Kassasjon ;  ;  ; Avdeling for medisinsk teknologi og informatikk ; Klinikk for Medisinsk teknologi ; Helse Stavanger HF ; Helse Vest RHF";;;;;;;;;;;;;;;;;;;;;;;;;;;;;
HST015587;Normal/Akutt;Kaputt O2 celle.;007421;Ventilator, intensiv, voksen/barn;84 11 740;;;;;22.02.2007;22.02.2007;*  (hsti);Har skiftet O2 celle, testet ok.;"Intensiv 2M ; Intensivavdelingen ; Klinikk A ; Helse Stavanger HF ; Helse Vest RHF";;4204063;"Intensiv 2M ; Intensivavdelingen ; Klinikk A ; Helse Stavanger HF ; Helse Vest RHF";;;200,00;0,00;"Intensiv 2M ; Intensivavdelingen ; Klinikk A ; Helse Stavanger HF ; Helse Vest RHF";;;;;;;;;;;;;;;;;;;;;;;;;;;;;
HST015634;Normal/Akutt;Virker som om maskinen gir ok resp. men flowkurvene forsvant plutselig.;007421;Ventilator, intensiv, voksen/barn;84 11 740;;;;;01.03.2007;01.03.2007;*  (hsti);Ved test viste det seg at det var kommet vann inn i maskinen, (har komt inn i insp. ventil via pas. slange.) Fikk tørket bort mesteparten av vannet og har latt maskinen stå å gå til tørk et par døgn. Har utført to års service på app. Alt ok. Bør skifte batteriene når nye er på plass pga alder.;"Intensiv 2M ; Intensivavdelingen ; Klinikk A ; Helse Stavanger HF ; Helse Vest RHF";;4204063;"Intensiv 2M ; Intensivavdelingen ; Klinikk A ; Helse Stavanger HF ; Helse Vest RHF";;;0,00;0,00;"Intensiv 2M ; Intensivavdelingen ; Klinikk A ; Helse Stavanger HF ; Helse Vest RHF";;;;;;;;;;;;;;;;;;;;;;;;;;;;;
HST015761;Normal/Akutt;Trenger ny O2 celle.;008565;Ventilator, intensiv, voksen/barn;8414900-07;;;;;20.03.2007;20.03.2007;*  (hsti);Har skiftet O2 celle, testet ok.;"Kassasjon ;  ;  ; Avdeling for medisinsk teknologi og informatikk ; Klinikk for Medisinsk teknologi ; Helse Stavanger HF ; Helse Vest RHF";;4204063;"Intensiv 2M ; Intensivavdelingen ; Klinikk A ; Helse Stavanger HF ; Helse Vest RHF";;;200,00;0,03;"Kassasjon ;  ;  ; Avdeling for medisinsk teknologi og informatikk ; Klinikk for Medisinsk teknologi ; Helse Stavanger HF ; Helse Vest RHF";;;;;;;;;;;;;;;;;;;;;;;;;;;;;
HST015783;Normal/Akutt;Bruker klager over at bekreftelsesrattet fungerer dårlig.;005776;Ventilator, intensiv, voksen/barn;84 11 740;;;;;23.03.2007;23.03.2007;*  (hsti);Har skiftet bekreftelsesrattbryteren, testet ok.;"Kassasjon ;  ;  ; Avdeling for medisinsk teknologi og informatikk ; Klinikk for Medisinsk teknologi ; Helse Stavanger HF ; Helse Vest RHF";;4204063;"Intensiv 2M ; Intensivavdelingen ; Klinikk A ; Helse Stavanger HF ; Helse Vest RHF";;;400,00;0,00;"Kassasjon ;  ;  ; Avdeling for medisinsk teknologi og informatikk ; Klinikk for Medisinsk teknologi ; Helse Stavanger HF ; Helse Vest RHF";;;;;;;;;;;;;;;;;;;;;;;;;;;;;
HST015958;Normal/Akutt;Testet batteri ok. Prøvde senere å sette på resp. uten strøm. Skjermen ble da svart med gul stripe over og alarmerte. (Resp. gikk på batteri);005781;Ventilator, intensiv, voksen/barn;84 11 740;;;;;18.05.2007;18.05.2007;*  (hsti);Har skiftet batteri og utført to års service. Har hatt resp. til test en uke uten at jeg har fått frem feilen den kom ned med. Ok.;"Intensiv 2M ; Intensivavdelingen ; Klinikk A ; Helse Stavanger HF ; Helse Vest RHF";;4204063;"Intensiv 2M ; Intensivavdelingen ; Klinikk A ; Helse Stavanger HF ; Helse Vest RHF";;;1 600,00;0,00;"Intensiv 2M ; Intensivavdelingen ; Klinikk A ; Helse Stavanger HF ; Helse Vest RHF";;;;;;;;;;;;;;;;;;;;;;;;;;;;;
HST016002;Normal/Akutt;Alarmerer på høy FiO2, hjalp ikke med ny O2 celle.;005779;Ventilator, intensiv, voksen/barn;84 11 740;;;;;30.05.2007;30.05.2007;*  (hsti);Har skiftet Diaphragm connection O2, ser ut til å fungere ok med ny. (Ligger i insp. blokken inntil O2 cellen.);"MTI MU mulig kassert ;  ;  ; Avdeling for medisinsk teknologi og informatikk ; Klinikk for Medisinsk teknologi ; Helse Stavanger HF ; Helse Vest RHF";;4204063;"Intensiv 2M ; Intensivavdelingen ; Klinikk A ; Helse Stavanger HF ; Helse Vest RHF";;;0,00;0,02;"MTI MU mulig kassert ;  ;  ; Avdeling for medisinsk teknologi og informatikk ; Klinikk for Medisinsk teknologi ; Helse Stavanger HF ; Helse Vest RHF";;;;;;;;;;;;;;;;;;;;;;;;;;;;;
HST070627;Normal/Akutt;Skjermen flimmret;005782;Ventilator, intensiv, voksen/barn;84 11 740;;;;;05.06.2007;08.06.2007;Nina Karin Brimsø Hermansen (henkei);Byttet lysrør og oppgraderingskitt for skjerm. Byttet bekreftelsesratt.;"Kassasjon ;  ;  ; Avdeling for medisinsk teknologi og informatikk ; Klinikk for Medisinsk teknologi ; Helse Stavanger HF ; Helse Vest RHF";;4204063;"Intensiv 2M ; Intensivavdelingen ; Klinikk A ; Helse Stavanger HF ; Helse Vest RHF";;;0,00;0,00;"Kassasjon ;  ;  ; Avdeling for medisinsk teknologi og informatikk ; Klinikk for Medisinsk teknologi ; Helse Stavanger HF ; Helse Vest RHF";;;;;;;;;;;;;;;;;;;;;;;;;;;;;
HST070728;Normal/Akutt;Skjermen flimrer.;005783;Ventilator, intensiv, voksen/barn;84 11 740;;;;;19.07.2007;19.07.2007;*  (hsti);"Har skiftet lysrør og oppgradert skjermen med oppgraderingskit.
Foretok 2 års pv av app. da viste det seg at PEEP ventilen var kaputt. (Viste negativ offset ventil v/ kalibrering.) Har skiftet PEEP ventil, deler i forb. med to års service og batterier i app.
Testet og funnet ok.";"Kassasjon ;  ;  ; Avdeling for medisinsk teknologi og informatikk ; Klinikk for Medisinsk teknologi ; Helse Stavanger HF ; Helse Vest RHF";;4204063;"Intensiv 2M ; Intensivavdelingen ; Klinikk A ; Helse Stavanger HF ; Helse Vest RHF";;;0,00;0,00;"Kassasjon ;  ;  ; Avdeling for medisinsk teknologi og informatikk ; Klinikk for Medisinsk teknologi ; Helse Stavanger HF ; Helse Vest RHF";;;;;;;;;;;;;;;;;;;;;;;;;;;;;
HST070781;Normal/Akutt;Årlig pv.;005777;Ventilator, intensiv, voksen/barn;84 11 740;28.03.2000;;;;27.07.2007;27.07.2007;*  (hsti);Første feil oppstod etter batt. test, AC modulen var kaputt. Fikk ikke liv i app. igjen. Kun tikking og hyling... Skiftet AC modul, da oppstod probl. 2, PEEP ventilens offset verdi var negativ. Skiftet PEEP ventil. Har skiftet deler i hht to års service. Alt ok til slutt.;"Kassasjon ;  ;  ; Avdeling for medisinsk teknologi og informatikk ; Klinikk for Medisinsk teknologi ; Helse Stavanger HF ; Helse Vest RHF";;4204063;"Intensiv 2M ; Intensivavdelingen ; Klinikk A ; Helse Stavanger HF ; Helse Vest RHF";;;0,00;0,00;"Kassasjon ;  ;  ; Avdeling for medisinsk teknologi og informatikk ; Klinikk for Medisinsk teknologi ; Helse Stavanger HF ; Helse Vest RHF";;;;;;;;;;;;;;;;;;;;;;;;;;;;;
HST070791;Normal/Akutt;Får ikke tatt apparatkontroll. Når man aktiverte kontroll på skjermen går apparatet tilbake igjen.;005778;Ventilator, intensiv, voksen/barn;84 11 740;;;;;01.08.2007;01.08.2007;Nina Karin Brimsø Hermansen (henkei);Fikk samme problem da jeg prøvde å ta apparatkontroll nede hos meg. Gik inni loggen for å se om det var feilmeldinmger og trykket litt frem og tilbake mellom skjermbildene. Da jeg så prøvde å ta apparatkontroll på ny gikk det helt fint. Testet apparatet over flere dager, skrudd av og på og tatt mange apparatkontroller som har gått helt fint. Snakket med Draeger v/Dag Dekkhus og ba ham sjekke opp med Tyskland om de hadde noen formening om hva som kunne være problemet. Han fikk tilbakemelding om at maskinen kjører en 0-kalibrering av pasient air valve sensoren med jevne mellomrom. Hvis maskinen var opptatt med denne kalibreringen fikk man ikke kjørt apparatkontrollen. Denne kalibreringen kunne ta opptil 3 minutter. Han mente at så lenge alt fungerte ok nå var det høyst sannsynlig at det var dette som var grunnen til at vi ikke fikk kjørt apparatkontrollen. Jeg ba ham sende underlag/den pdf-filen som beskrev dette.;"Kassasjon ;  ;  ; Avdeling for medisinsk teknologi og informatikk ; Klinikk for Medisinsk teknologi ; Helse Stavanger HF ; Helse Vest RHF";;4204063;"Intensiv 2M ; Intensivavdelingen ; Klinikk A ; Helse Stavanger HF ; Helse Vest RHF";;;0,00;0,00;"Kassasjon ;  ;  ; Avdeling for medisinsk teknologi og informatikk ; Klinikk for Medisinsk teknologi ; Helse Stavanger HF ; Helse Vest RHF";;;;;;;;;;;;;;;;;;;;;;;;;;;;;
HST070841;Normal/Akutt;"Feilbeskrivelse: Respirtoren har vært avslått, setter på respiratoren . Etter ca. 20 min: Rød melding 02.71.003
Slår av respiratoren, så er meldingen borte.";005764;Ventilator, intensiv, voksen/barn;84 11 740;;;;;15.08.2007;15.08.2007;Nina Karin Brimsø Hermansen (henkei);"Feilmeldingen henspeiler på Gold Cap capasitor, capacitance too low.
Når jeg testet apparatet nede hos meg er alt ok, får ikke opp noen feilmelding. Ca. 20 min etter at apparatet er slått på og så hver time testes både funksjon og kapasitansen til Gold Cap capasitoren. Sjekket verdiene til Gold Cap: 8.545V og Gold Cap
(mF,LSB)  81  102,  2128  2053  1995
Gold Cap (Ohm,LSB) 36,  3124  2443
Snakket med Pål Kristand, han sa at så lenge verdiene var fine 8,5V og 80mF så så alt veldig greit ut. Det kunne være at Av/På knappen bak hadde vært i en mellomposisjon og at det da kunne bli feil motstand når maskinen tok denne testen, det hadde vist vært tilfeller der det var blitt rapportert. Han mente at hvis jeg hadde kjørt maskinen over noe tid og ikke fått frem noe feil var det veldig lite sansynlig at feilen ville dukke opp igjen. Hvis det mot formoddning skulle skje igjen, ville han prøvd å bytte powerenheten.";"Kassasjon ;  ;  ; Avdeling for medisinsk teknologi og informatikk ; Klinikk for Medisinsk teknologi ; Helse Stavanger HF ; Helse Vest RHF";;4204063;"Intensiv 2M ; Intensivavdelingen ; Klinikk A ; Helse Stavanger HF ; Helse Vest RHF";;;0,00;0,00;"Kassasjon ;  ;  ; Avdeling for medisinsk teknologi og informatikk ; Klinikk for Medisinsk teknologi ; Helse Stavanger HF ; Helse Vest RHF";;;;;;;;;;;;;;;;;;;;;;;;;;;;;
HST070918;Normal/Akutt;Bruker skulle kontrollere apparatet, da det smalt og luktet svidd. Etterpå var apparatet helt dødt.;008567;Ventilator, intensiv, voksen/barn;8414900-07;;;;;13.09.2007;13.09.2007;*  (hsti);AC del av powersupply var kaputt, alt ok med nytt powersupply. Har utført to- årsservice på app. Skiftet batteri, backupbatteri, filter og pakninger. Testet og funnet ok!;"Kassasjon ;  ;  ; Avdeling for medisinsk teknologi og informatikk ; Klinikk for Medisinsk teknologi ; Helse Stavanger HF ; Helse Vest RHF";;4204063;"Intensiv 2M ; Intensivavdelingen ; Klinikk A ; Helse Stavanger HF ; Helse Vest RHF";;;0,00;0,00;"Kassasjon ;  ;  ; Avdeling for medisinsk teknologi og informatikk ; Klinikk for Medisinsk teknologi ; Helse Stavanger HF ; Helse Vest RHF";;;;;;;;;;;;;;;;;;;;;;;;;;;;;
HST071207;Normal/Akutt;Får ikke kalibrert O2.;005783;Ventilator, intensiv, voksen/barn;84 11 740;;;;;05.11.2007;05.11.2007;*  (hsti);Har skiftet O2 celle, kalibreres ok med ny celle.;"Kassasjon ;  ;  ; Avdeling for medisinsk teknologi og informatikk ; Klinikk for Medisinsk teknologi ; Helse Stavanger HF ; Helse Vest RHF";;4204063;"Intensiv 2M ; Intensivavdelingen ; Klinikk A ; Helse Stavanger HF ; Helse Vest RHF";;;0,00;0,00;"Kassasjon ;  ;  ; Avdeling for medisinsk teknologi og informatikk ; Klinikk for Medisinsk teknologi ; Helse Stavanger HF ; Helse Vest RHF";;;;;;;;;;;;;;;;;;;;;;;;;;;;;
HST071333;Normal/Akutt;Får ikke kalibrert O2.;005782;Ventilator, intensiv, voksen/barn;84 11 740;;;;;21.11.2007;21.11.2007;*  (hsti);Har skiftet O2 celle, testet og funnet ok.;"Kassasjon ;  ;  ; Avdeling for medisinsk teknologi og informatikk ; Klinikk for Medisinsk teknologi ; Helse Stavanger HF ; Helse Vest RHF";;4204063;"Intensiv 2M ; Intensivavdelingen ; Klinikk A ; Helse Stavanger HF ; Helse Vest RHF";;;0,00;0,00;"Kassasjon ;  ;  ; Avdeling for medisinsk teknologi og informatikk ; Klinikk for Medisinsk teknologi ; Helse Stavanger HF ; Helse Vest RHF";;;;;;;;;;;;;;;;;;;;;;;;;;;;;
HST071336;Normal/Akutt;Får feilmelding ved O2 kalibrering.;008566;Ventilator, intensiv, voksen/barn;8414900-07;;;;;21.11.2007;21.11.2007;*  (hsti);Har skiftet O2 celle, testet og funnet ok.;"Kassasjon ;  ;  ; Avdeling for medisinsk teknologi og informatikk ; Klinikk for Medisinsk teknologi ; Helse Stavanger HF ; Helse Vest RHF";;4204063;"Intensiv 2M ; Intensivavdelingen ; Klinikk A ; Helse Stavanger HF ; Helse Vest RHF";;;0,00;0,00;"Kassasjon ;  ;  ; Avdeling for medisinsk teknologi og informatikk ; Klinikk for Medisinsk teknologi ; Helse Stavanger HF ; Helse Vest RHF";;;;;;;;;;;;;;;;;;;;;;;;;;;;;
HST071376;Normal/Akutt;Ikke bilde, kun hvit skjerm.;005784;Ventilator, intensiv, voksen/barn;84 11 740;;;;;10.11.2007;17.11.2007;*  (hsti);Brytere og ratt på fronten fungerer ok, høres ut som om app. går fint igjennom selvtest. Har rikset litt på skjermen og plutselig var bilde på plass. Skrudde opp skjermen og kikket etter løse kabler, fant ingen. Har skiftet backlight bare for å ha gjort noe. Skiftet batteri på app. Vær obs dersom app. kommer tilbake med samme feil!! Har stått til test hos oss i en ukes tid.;"Kassasjon ;  ;  ; Avdeling for medisinsk teknologi og informatikk ; Klinikk for Medisinsk teknologi ; Helse Stavanger HF ; Helse Vest RHF";;4204063;"Intensiv 2M ; Intensivavdelingen ; Klinikk A ; Helse Stavanger HF ; Helse Vest RHF";;;0,00;0,00;"Kassasjon ;  ;  ; Avdeling for medisinsk teknologi og informatikk ; Klinikk for Medisinsk teknologi ; Helse Stavanger HF ; Helse Vest RHF";;;;;;;;;;;;;;;;;;;;;;;;;;;;;
HST071377;Normal/Akutt;Skjermen var svart. Ved påslag av apparatet går apparatet igjennom selvtesten, men skjermen forblir svart (muligens noen svarte striper);007421;Ventilator, intensiv, voksen/barn;84 11 740;;;;;04.12.2007;06.12.2007;Nina Karin Brimsø Hermansen (henkei);"Tok apparatet ned til meg. Ved påslag her var skjermen forsatt svart, men så ut som om noen hadde slått til displayet (svart/gråtoner som fløt)
Jeg prøvde å få frem bilde ved å bøye/bende på kabelen mellom controllenheten og pneumatikkenhet, uten at dette hjalp.
Vinklet på skjermen  og plutselig var bildet tilbake. Klart ikke etterpå å fremprovosere feilen.
Etter samtale med Tore : Tatt ut alle kabler i kontrollenheten og satt de på plass igjen (ingen som synlig satt dårlig). Byttet backlight. Byttet kabel mellom kontrollenhet og pneumatikkenhet. Testet over flere dager uten å få frem feilen.";"Intensiv 2M ; Intensivavdelingen ; Klinikk A ; Helse Stavanger HF ; Helse Vest RHF";;4204063;"Intensiv 2M ; Intensivavdelingen ; Klinikk A ; Helse Stavanger HF ; Helse Vest RHF";;;0,00;0,00;"Intensiv 2M ; Intensivavdelingen ; Klinikk A ; Helse Stavanger HF ; Helse Vest RHF";;;;;;;;;;;;;;;;;;;;;;;;;;;;;
HST071424;Normal/Akutt;Luft problematikk. Erna har avtalt med Jarl Lyder Hansen at app. skal sendes inn. 20/12-07.;007421;Ventilator, intensiv, voksen/barn;84 11 740;;;;;20.12.2007;07.01.2008;*  (hsti);Bergman har sjekket prøvesvar som fulgte med maskinen. Der var det beskjed om mulig luft i prøve. Dette kan være grunnen til at prøven ikke samsvarte med lab. Demonterte maskin, sjekket slanger og staket opp kalibreringsslanger for sikkerhetsskyld. Kjørt opp test med blod på ABL 835 og ABL 77. Prøvene samsvarte greit. Årsaken til problemene kan også være sensorkassetter som ikke har vært i orden eøøer ikke blitt behandlet riktig. Det ser iallefall greit ut nå.;"Intensiv 2M ; Intensivavdelingen ; Klinikk A ; Helse Stavanger HF ; Helse Vest RHF";;4204063;"Intensiv 2M ; Intensivavdelingen ; Klinikk A ; Helse Stavanger HF ; Helse Vest RHF";;;0,00;0,00;"Intensiv 2M ; Intensivavdelingen ; Klinikk A ; Helse Stavanger HF ; Helse Vest RHF";;;;;;;;;;;;;;;;;;;;;;;;;;;;;
HST080029;Normal/Akutt;Ikke alle knappene på touch screenen fungerer.;008567;Ventilator, intensiv, voksen/barn;8414900-07;;;;;08.01.2008;08.01.2008;*  (hsti);Har skiftet touch screen, fungerer ok med ny.;"Kassasjon ;  ;  ; Avdeling for medisinsk teknologi og informatikk ; Klinikk for Medisinsk teknologi ; Helse Stavanger HF ; Helse Vest RHF";;4204063;"Intensiv 2M ; Intensivavdelingen ; Klinikk A ; Helse Stavanger HF ; Helse Vest RHF";;;0,00;0,00;"Kassasjon ;  ;  ; Avdeling for medisinsk teknologi og informatikk ; Klinikk for Medisinsk teknologi ; Helse Stavanger HF ; Helse Vest RHF";;;;;;;;;;;;;;;;;;;;;;;;;;;;;
HST080104;Normal/Akutt;Grønnskjær i skjermen.;005764;Ventilator, intensiv, voksen/barn;84 11 740;;;;;28.01.2008;28.01.2008;*  (hsti);Har skiftet backlight og oppgradert skjermen, byttet deler for to årsservice. (Backupbatteri + gass filter.) Har også skiftet batteri i app. Testet ok.;"Kassasjon ;  ;  ; Avdeling for medisinsk teknologi og informatikk ; Klinikk for Medisinsk teknologi ; Helse Stavanger HF ; Helse Vest RHF";;4204063;"Intensiv 2M ; Intensivavdelingen ; Klinikk A ; Helse Stavanger HF ; Helse Vest RHF";;;0,00;0,00;"Kassasjon ;  ;  ; Avdeling for medisinsk teknologi og informatikk ; Klinikk for Medisinsk teknologi ; Helse Stavanger HF ; Helse Vest RHF";;;;;;;;;;;;;;;;;;;;;;;;;;;;;
