AO-nr.;AO-type;Oppgave/feilbeskrivelse;Reg.nr.;Utstyrsgruppe;Modell;Seneste PV;Neste PV;Oppdatert;Oppdatert av Sign;Reg. dato;Ferdig;Sign;Teknisk beskrivelse;Plassering (utstyr);Gruppe;Kundekode;Kunde;Sak;Kundetekst;Totalt;Nedetid;Plassering;;;;;;;;;;;;;;;;;;;;;;;;;;;;;
HST000123;Normal/Akutt;;000813;Ventilator, intensiv, voksen/barn;E037E-SV 900;;;;;20.09.1990;20.09.1990;* Originale data (!SYS);"PERIODISK FEIL I STEPMOTOR, BLIR STÅENDE I STENGT POS. SLIK AT RESPIRASJON    
HINDRES BYTTET DEFEKT STEPMOTOR SOM HADDE EN NOE ANNEN KARAK- TERISTIKK ENN   
DE NYE. FUNKSJONS OG SIKKERHETSKONTR. FUNNET OK.  NB. LITT VEL MYE            
TRAFO-DUR, UTEN AT NOE ER GJORT MED DETTE. RESPIRATOREN GIR HELLER IKKE UT  
INSP.TIME OG EKSP. TIME PÅ BØSSINGENE TIL TILLEGGSUTSTYR BAK PÅ APP           
APP.PLASSERT PÅ CT, DVS IKKE BRUK FOR FORSTØVER.";"Kassasjon ;  ;  ; Avdeling for medisinsk teknologi og informatikk ; Klinikk for Medisinsk teknologi ; Helse Stavanger HF ; Helse Vest RHF";;5-1;"Kassasjon ;  ;  ; Avdeling for medisinsk teknologi og informatikk ; Klinikk for Medisinsk teknologi ; Helse Stavanger HF ; Helse Vest RHF";;;0,00;0,00;"Kassasjon ;  ;  ; Avdeling for medisinsk teknologi og informatikk ; Klinikk for Medisinsk teknologi ; Helse Stavanger HF ; Helse Vest RHF";;;;;;;;;;;;;;;;;;;;;;;;;;;;;
HST005153;Normal/Akutt;inoperativ;003568;Ventilator, intensiv, barn/nyfødte;BP 2001 BV 143;;;;;21.09.1997;21.04.1999;Rune Aalberg (aaruau);Produsenten foretatt liten service på enheten.;"Kassasjon ;  ;  ; Avdeling for medisinsk teknologi og informatikk ; Klinikk for Medisinsk teknologi ; Helse Stavanger HF ; Helse Vest RHF";;5-1;"Kassasjon ;  ;  ; Avdeling for medisinsk teknologi og informatikk ; Klinikk for Medisinsk teknologi ; Helse Stavanger HF ; Helse Vest RHF";;;0,00;14 232,00;"Kassasjon ;  ;  ; Avdeling for medisinsk teknologi og informatikk ; Klinikk for Medisinsk teknologi ; Helse Stavanger HF ; Helse Vest RHF";;;;;;;;;;;;;;;;;;;;;;;;;;;;;
HST005190;Normal/Akutt;Viser feil utandat min. volum.;001074;Ventilator, intensiv, voksen/barn;E347E SV 900C;28.08.1997;;;;03.05.1999;03.05.1999;* Originale data (!SYS);Skiftet eksp. flowsensor, testet og funnet ok.;"Kassasjon ;  ;  ; Avdeling for medisinsk teknologi og informatikk ; Klinikk for Medisinsk teknologi ; Helse Stavanger HF ; Helse Vest RHF";;5-1;"Kassasjon ;  ;  ; Avdeling for medisinsk teknologi og informatikk ; Klinikk for Medisinsk teknologi ; Helse Stavanger HF ; Helse Vest RHF";;;0,00;0,00;"Kassasjon ;  ;  ; Avdeling for medisinsk teknologi og informatikk ; Klinikk for Medisinsk teknologi ; Helse Stavanger HF ; Helse Vest RHF";;;;;;;;;;;;;;;;;;;;;;;;;;;;;
HST005191;Normal/Akutt;App. er ikke ok. Ved bruk på pasient kan det virke som den lekker (3-4 liter). Når den står og går en stund uten å være tilkoplet pasient innstilt på 7,5 liter, gir den 9-10 lliter. Det virker da som den bygger seg opp. Ved vanlig sjekk uten at den står og går over tid, da ser alt OK ut.;001073;Ventilator, intensiv, voksen/barn;E037E-SV 900B;;;;;06.05.1999;11.05.1999;* Originale data (!SYS);Kalibrert ventilatoren, og da måtte det noen små justeringer til. Etterpå lot vi den stå og gå over lengre tid, og da virket den tilfredsstillende. Håper det kun var de små justeringene som forårsaket feilen.;"Kassasjon ;  ;  ; Avdeling for medisinsk teknologi og informatikk ; Klinikk for Medisinsk teknologi ; Helse Stavanger HF ; Helse Vest RHF";;5-1;"Kassasjon ;  ;  ; Avdeling for medisinsk teknologi og informatikk ; Klinikk for Medisinsk teknologi ; Helse Stavanger HF ; Helse Vest RHF";;;1 500,00;144,00;"Kassasjon ;  ;  ; Avdeling for medisinsk teknologi og informatikk ; Klinikk for Medisinsk teknologi ; Helse Stavanger HF ; Helse Vest RHF";;;;;;;;;;;;;;;;;;;;;;;;;;;;;
HST000399;Normal/Akutt;;001073;Ventilator, intensiv, voksen/barn;E037E-SV 900B;;;;;27.11.1991;27.11.1991;Rune Aalberg (aaruau);LØSNET DEL PÅ PEEPVENTIL.  SKRUDD TIL UMBRACOSKRUEN TILHØRENDE LØSNET DEL.;"Kassasjon ;  ;  ; Avdeling for medisinsk teknologi og informatikk ; Klinikk for Medisinsk teknologi ; Helse Stavanger HF ; Helse Vest RHF";;5-1;"Kassasjon ;  ;  ; Avdeling for medisinsk teknologi og informatikk ; Klinikk for Medisinsk teknologi ; Helse Stavanger HF ; Helse Vest RHF";;;0,00;0,00;"Kassasjon ;  ;  ; Avdeling for medisinsk teknologi og informatikk ; Klinikk for Medisinsk teknologi ; Helse Stavanger HF ; Helse Vest RHF";;;;;;;;;;;;;;;;;;;;;;;;;;;;;
HST000400;Normal/Akutt;;001073;Ventilator, intensiv, voksen/barn;E037E-SV 900B;;;;;01.01.1980;01.01.1980;* Originale data (!SYS);1000 TIMERS SERVICE JUSTERT VENTIL FOR GASSBOKS,DEFEKT GLASS LUFTVEGSTRYKK;"Kassasjon ;  ;  ; Avdeling for medisinsk teknologi og informatikk ; Klinikk for Medisinsk teknologi ; Helse Stavanger HF ; Helse Vest RHF";;5-1;"Kassasjon ;  ;  ; Avdeling for medisinsk teknologi og informatikk ; Klinikk for Medisinsk teknologi ; Helse Stavanger HF ; Helse Vest RHF";;;0,00;0,00;"Kassasjon ;  ;  ; Avdeling for medisinsk teknologi og informatikk ; Klinikk for Medisinsk teknologi ; Helse Stavanger HF ; Helse Vest RHF";;;;;;;;;;;;;;;;;;;;;;;;;;;;;
HST000401;Normal/Akutt;;001073;Ventilator, intensiv, voksen/barn;E037E-SV 900B;;;;;01.01.1980;01.01.1980;* Originale data (!SYS);"FEIL VED MÅLING AV LUFTVEGSTRYKKET. SKIFTET FORSTERKERKORT FOR              
TRYKK-TRANSDUCER";"Kassasjon ;  ;  ; Avdeling for medisinsk teknologi og informatikk ; Klinikk for Medisinsk teknologi ; Helse Stavanger HF ; Helse Vest RHF";;5-1;"Kassasjon ;  ;  ; Avdeling for medisinsk teknologi og informatikk ; Klinikk for Medisinsk teknologi ; Helse Stavanger HF ; Helse Vest RHF";;;0,00;0,00;"Kassasjon ;  ;  ; Avdeling for medisinsk teknologi og informatikk ; Klinikk for Medisinsk teknologi ; Helse Stavanger HF ; Helse Vest RHF";;;;;;;;;;;;;;;;;;;;;;;;;;;;;
HST000402;Normal/Akutt;;001073;Ventilator, intensiv, voksen/barn;E037E-SV 900B;;;;;21.11.1990;21.11.1990;* Originale data (!SYS);"LEKKET N20 INNE VED SIKKERHETSVENTIL INNE I HUSET.  BYGGET INN LUKKET         
SIKKERHETSVENTIL OG EVAC.UNIT FOR N20-EVACUATION. SIKKERHETS OG               
FUNKSJONSTESTET FUNNET OK.";"Kassasjon ;  ;  ; Avdeling for medisinsk teknologi og informatikk ; Klinikk for Medisinsk teknologi ; Helse Stavanger HF ; Helse Vest RHF";;5-1;"Kassasjon ;  ;  ; Avdeling for medisinsk teknologi og informatikk ; Klinikk for Medisinsk teknologi ; Helse Stavanger HF ; Helse Vest RHF";;;0,00;4,00;"Kassasjon ;  ;  ; Avdeling for medisinsk teknologi og informatikk ; Klinikk for Medisinsk teknologi ; Helse Stavanger HF ; Helse Vest RHF";;;;;;;;;;;;;;;;;;;;;;;;;;;;;
HST000403;Normal/Akutt;;001073;Ventilator, intensiv, voksen/barn;E037E-SV 900B;;;;;12.01.1995;12.01.1995;Rune Aalberg (aaruau);"AVD.: DOBBEL ISOFLURAN- OG HALV N2O-KONSENTRASJON I FØLGE ULTIMA. TESTET OG   
FUNNET I ORDEN.";"Kassasjon ;  ;  ; Avdeling for medisinsk teknologi og informatikk ; Klinikk for Medisinsk teknologi ; Helse Stavanger HF ; Helse Vest RHF";;5-1;"Kassasjon ;  ;  ; Avdeling for medisinsk teknologi og informatikk ; Klinikk for Medisinsk teknologi ; Helse Stavanger HF ; Helse Vest RHF";;;0,00;740,00;"Kassasjon ;  ;  ; Avdeling for medisinsk teknologi og informatikk ; Klinikk for Medisinsk teknologi ; Helse Stavanger HF ; Helse Vest RHF";;;;;;;;;;;;;;;;;;;;;;;;;;;;;
HST000404;Normal/Akutt;;001073;Ventilator, intensiv, voksen/barn;E037E-SV 900B;;;;;16.04.1991;16.04.1991;* Originale data (!SYS);"STOPPET SPONTANT I LUKKET STILLING UNDER BRUK, DETTE SKJEDDE 2 GANGER. BYTTET 
STEPMOTOR, DA DENNE IFLG. SIEMENS KUNNE HA PROBLEMER MED Å DETEKTERE          
ENDESTILLINGER OG DA OPPFØRE SEG SOM BESKREVET. KJØRT VENTILATOREN OVER       
LENGRE TID UTEN Å FÅ FREM FEILEN. JUSTERT OPP VENTILATOREN, SIKKERHETS OG     
FUNKSJONSTESTET FUNNET OK. SKADEMELDING GITT STEM, V NILSSON, 100491.";"Kassasjon ;  ;  ; Avdeling for medisinsk teknologi og informatikk ; Klinikk for Medisinsk teknologi ; Helse Stavanger HF ; Helse Vest RHF";;5-1;"Kassasjon ;  ;  ; Avdeling for medisinsk teknologi og informatikk ; Klinikk for Medisinsk teknologi ; Helse Stavanger HF ; Helse Vest RHF";;;0,00;0,00;"Kassasjon ;  ;  ; Avdeling for medisinsk teknologi og informatikk ; Klinikk for Medisinsk teknologi ; Helse Stavanger HF ; Helse Vest RHF";;;;;;;;;;;;;;;;;;;;;;;;;;;;;
HST000405;Normal/Akutt;;001073;Ventilator, intensiv, voksen/barn;E037E-SV 900B;;;;;09.09.1993;09.09.1993;Rune Aalberg (aaruau);"1000-TIMER.  UTFØRT 1000-TIMERS SERVICE. ANTAGELIG EN LEKKASJE I              
GASSMIKSEREN. DENNE BLIR SENDT TIL REP. NÅR UTBYTTE- MIKSEREN KOMMER.";"Kassasjon ;  ;  ; Avdeling for medisinsk teknologi og informatikk ; Klinikk for Medisinsk teknologi ; Helse Stavanger HF ; Helse Vest RHF";;5-1;"Kassasjon ;  ;  ; Avdeling for medisinsk teknologi og informatikk ; Klinikk for Medisinsk teknologi ; Helse Stavanger HF ; Helse Vest RHF";;;0,00;27,00;"Kassasjon ;  ;  ; Avdeling for medisinsk teknologi og informatikk ; Klinikk for Medisinsk teknologi ; Helse Stavanger HF ; Helse Vest RHF";;;;;;;;;;;;;;;;;;;;;;;;;;;;;
HST000406;Normal/Akutt;;001073;Ventilator, intensiv, voksen/barn;E037E-SV 900B;;;;;24.04.1996;24.04.1996;* Espen HELLANG (EH);"NESTENUHELL MED FORDAMPEREN  BRUKERNE HADDE IKKE KOPLET FORDAMPEREN SKIKKELIG 
TIL SERVOEN. HENDELSEN MELDT, OG SERVOEN LEVERT UT IGJEN,";"Kassasjon ;  ;  ; Avdeling for medisinsk teknologi og informatikk ; Klinikk for Medisinsk teknologi ; Helse Stavanger HF ; Helse Vest RHF";;5-1;"Kassasjon ;  ;  ; Avdeling for medisinsk teknologi og informatikk ; Klinikk for Medisinsk teknologi ; Helse Stavanger HF ; Helse Vest RHF";;;0,00;0,00;"Kassasjon ;  ;  ; Avdeling for medisinsk teknologi og informatikk ; Klinikk for Medisinsk teknologi ; Helse Stavanger HF ; Helse Vest RHF";;;;;;;;;;;;;;;;;;;;;;;;;;;;;
HST000407;Normal/Akutt;;001074;Ventilator, intensiv, voksen/barn;E347E SV 900C;28.08.1997;;;;06.02.1995;06.02.1995;Rune Aalberg (aaruau);"UTÅNDET MINUTTVOLUM LIK 0.                                                    
BYTTET FLOWTRANSDUCER. KALIBRERT I HENHOLD TIL PROSEDYRE.";"Kassasjon ;  ;  ; Avdeling for medisinsk teknologi og informatikk ; Klinikk for Medisinsk teknologi ; Helse Stavanger HF ; Helse Vest RHF";;5-1;"Kassasjon ;  ;  ; Avdeling for medisinsk teknologi og informatikk ; Klinikk for Medisinsk teknologi ; Helse Stavanger HF ; Helse Vest RHF";;;0,00;4,00;"Kassasjon ;  ;  ; Avdeling for medisinsk teknologi og informatikk ; Klinikk for Medisinsk teknologi ; Helse Stavanger HF ; Helse Vest RHF";;;;;;;;;;;;;;;;;;;;;;;;;;;;;
HST000408;Normal/Akutt;;001074;Ventilator, intensiv, voksen/barn;E347E SV 900C;28.08.1997;;;;01.01.1980;01.01.1980;* Originale data (!SYS);"ALARMERTE PÅ 10 CMH20, VED INNSTILT ALARMGRENSE PÅ 80 CMH20. KONTROLLERT AV   
SIEMENS UTEN AT NOEN FEIL BLE FUNNET.";"Kassasjon ;  ;  ; Avdeling for medisinsk teknologi og informatikk ; Klinikk for Medisinsk teknologi ; Helse Stavanger HF ; Helse Vest RHF";;5-1;"Kassasjon ;  ;  ; Avdeling for medisinsk teknologi og informatikk ; Klinikk for Medisinsk teknologi ; Helse Stavanger HF ; Helse Vest RHF";;;0,00;0,00;"Kassasjon ;  ;  ; Avdeling for medisinsk teknologi og informatikk ; Klinikk for Medisinsk teknologi ; Helse Stavanger HF ; Helse Vest RHF";;;;;;;;;;;;;;;;;;;;;;;;;;;;;
HST000409;Normal/Akutt;;001074;Ventilator, intensiv, voksen/barn;E347E SV 900C;28.08.1997;;;;01.01.1980;01.01.1980;* Originale data (!SYS);"GAV ALARM VED PAS.TRYKK PÅ 20CM H20, MENS TRYKKALARM VAR INNSTILT PÅ 80 CM    
H2O. BYTTET DEFEKT EKSPIRATORISK TRYKKTRANSDUCER, DA FEILEN LOT SEG           
FREMPROVOSERE VED Å BEVEGE DENNE TRANSDUCEREN. SIKKERHETS- OG                 
FUNKSJONSKONTROLLERT.";"Kassasjon ;  ;  ; Avdeling for medisinsk teknologi og informatikk ; Klinikk for Medisinsk teknologi ; Helse Stavanger HF ; Helse Vest RHF";;5-1;"Kassasjon ;  ;  ; Avdeling for medisinsk teknologi og informatikk ; Klinikk for Medisinsk teknologi ; Helse Stavanger HF ; Helse Vest RHF";;;0,00;0,00;"Kassasjon ;  ;  ; Avdeling for medisinsk teknologi og informatikk ; Klinikk for Medisinsk teknologi ; Helse Stavanger HF ; Helse Vest RHF";;;;;;;;;;;;;;;;;;;;;;;;;;;;;
HST000410;Normal/Akutt;;001074;Ventilator, intensiv, voksen/barn;E347E SV 900C;28.08.1997;;;;25.01.1990;25.01.1990;* Originale data (!SYS);"DEFEKT O2-CELLE. VISER FOR LAVE VERDIER.  BYTTET DEFEKT O2-CELLE, CALIBRERT   
APP I LUFT.";"Kassasjon ;  ;  ; Avdeling for medisinsk teknologi og informatikk ; Klinikk for Medisinsk teknologi ; Helse Stavanger HF ; Helse Vest RHF";;5-1;"Kassasjon ;  ;  ; Avdeling for medisinsk teknologi og informatikk ; Klinikk for Medisinsk teknologi ; Helse Stavanger HF ; Helse Vest RHF";;;0,00;0,00;"Kassasjon ;  ;  ; Avdeling for medisinsk teknologi og informatikk ; Klinikk for Medisinsk teknologi ; Helse Stavanger HF ; Helse Vest RHF";;;;;;;;;;;;;;;;;;;;;;;;;;;;;
HST000411;Normal/Akutt;;001074;Ventilator, intensiv, voksen/barn;E347E SV 900C;28.08.1997;;;;06.07.1990;06.07.1990;* Originale data (!SYS);"VISTE FOR LAVE VERDIER PÅ O2.  BYTTET DEFEKT O2-CELLE. KALIBRERT FUNKSJONS OG 
SIKKERHETSKONTROLLERT.";"Kassasjon ;  ;  ; Avdeling for medisinsk teknologi og informatikk ; Klinikk for Medisinsk teknologi ; Helse Stavanger HF ; Helse Vest RHF";;5-1;"Kassasjon ;  ;  ; Avdeling for medisinsk teknologi og informatikk ; Klinikk for Medisinsk teknologi ; Helse Stavanger HF ; Helse Vest RHF";;;0,00;2,00;"Kassasjon ;  ;  ; Avdeling for medisinsk teknologi og informatikk ; Klinikk for Medisinsk teknologi ; Helse Stavanger HF ; Helse Vest RHF";;;;;;;;;;;;;;;;;;;;;;;;;;;;;
HST000412;Normal/Akutt;;001074;Ventilator, intensiv, voksen/barn;E347E SV 900C;28.08.1997;;;;04.10.1990;04.10.1990;* Originale data (!SYS);"HADDE IKKE INTERNT AVSUG FOR FJERNING AV EVENTUELL LYSTGASS I PNEUMATIKK      
ENHET. MONTERT I NY SIKKERHETSVENTIL, FOR LUKKET SYSTEM, EVAC.UNIT OG         
SLANGER. SIKKERHETS OG FUNKSJONSTESTET. FUNNET OK.";"Kassasjon ;  ;  ; Avdeling for medisinsk teknologi og informatikk ; Klinikk for Medisinsk teknologi ; Helse Stavanger HF ; Helse Vest RHF";;5-1;"Kassasjon ;  ;  ; Avdeling for medisinsk teknologi og informatikk ; Klinikk for Medisinsk teknologi ; Helse Stavanger HF ; Helse Vest RHF";;;0,00;24,00;"Kassasjon ;  ;  ; Avdeling for medisinsk teknologi og informatikk ; Klinikk for Medisinsk teknologi ; Helse Stavanger HF ; Helse Vest RHF";;;;;;;;;;;;;;;;;;;;;;;;;;;;;
HST000413;Normal/Akutt;;001074;Ventilator, intensiv, voksen/barn;E347E SV 900C;28.08.1997;;;;12.02.1991;12.02.1991;* Originale data (!SYS);"DEFEKT O2-CELLE.  BYTTET OG JUSTERT OPP NY O2-CELLE. SIKKERHETSTESTET, FUNNET 
OK.";"Kassasjon ;  ;  ; Avdeling for medisinsk teknologi og informatikk ; Klinikk for Medisinsk teknologi ; Helse Stavanger HF ; Helse Vest RHF";;5-1;"Kassasjon ;  ;  ; Avdeling for medisinsk teknologi og informatikk ; Klinikk for Medisinsk teknologi ; Helse Stavanger HF ; Helse Vest RHF";;;0,00;2,00;"Kassasjon ;  ;  ; Avdeling for medisinsk teknologi og informatikk ; Klinikk for Medisinsk teknologi ; Helse Stavanger HF ; Helse Vest RHF";;;;;;;;;;;;;;;;;;;;;;;;;;;;;
HST000414;Normal/Akutt;;001074;Ventilator, intensiv, voksen/barn;E347E SV 900C;28.08.1997;;;;11.03.1991;11.03.1991;* Originale data (!SYS);DÅRLIG KONTAK I NETTLEDNING  UTBEDRET VAKKEL I NETTKABEL VED STØPSEL;"Kassasjon ;  ;  ; Avdeling for medisinsk teknologi og informatikk ; Klinikk for Medisinsk teknologi ; Helse Stavanger HF ; Helse Vest RHF";;5-1;"Kassasjon ;  ;  ; Avdeling for medisinsk teknologi og informatikk ; Klinikk for Medisinsk teknologi ; Helse Stavanger HF ; Helse Vest RHF";;;0,00;0,00;"Kassasjon ;  ;  ; Avdeling for medisinsk teknologi og informatikk ; Klinikk for Medisinsk teknologi ; Helse Stavanger HF ; Helse Vest RHF";;;;;;;;;;;;;;;;;;;;;;;;;;;;;
HST000415;Normal/Akutt;;001074;Ventilator, intensiv, voksen/barn;E347E SV 900C;28.08.1997;;;;26.01.1995;26.01.1995;Rune Aalberg (aaruau);"ØDELAGT TILKOBLINSSTUSS TIL EJEKTOR.  SKIFTET HURTIGKOBLING, GASSUTLØP PÅ     
EJEKTORSUG.";"Kassasjon ;  ;  ; Avdeling for medisinsk teknologi og informatikk ; Klinikk for Medisinsk teknologi ; Helse Stavanger HF ; Helse Vest RHF";;5-1;"Kassasjon ;  ;  ; Avdeling for medisinsk teknologi og informatikk ; Klinikk for Medisinsk teknologi ; Helse Stavanger HF ; Helse Vest RHF";;;0,00;164,00;"Kassasjon ;  ;  ; Avdeling for medisinsk teknologi og informatikk ; Klinikk for Medisinsk teknologi ; Helse Stavanger HF ; Helse Vest RHF";;;;;;;;;;;;;;;;;;;;;;;;;;;;;
HST000416;Normal/Akutt;;001074;Ventilator, intensiv, voksen/barn;E347E SV 900C;28.08.1997;;;;16.10.1991;16.10.1991;Rune Aalberg (aaruau);"MINUTTVOLUM AVLESNING FOR HØY I FORHOLD TIL INNSTILT. USTABILT POTENSIOMETER. 
SKIFTET POTENSIOMETER OG KALIBRERT. TESTET: OK!";"Kassasjon ;  ;  ; Avdeling for medisinsk teknologi og informatikk ; Klinikk for Medisinsk teknologi ; Helse Stavanger HF ; Helse Vest RHF";;5-1;"Kassasjon ;  ;  ; Avdeling for medisinsk teknologi og informatikk ; Klinikk for Medisinsk teknologi ; Helse Stavanger HF ; Helse Vest RHF";;;0,00;0,00;"Kassasjon ;  ;  ; Avdeling for medisinsk teknologi og informatikk ; Klinikk for Medisinsk teknologi ; Helse Stavanger HF ; Helse Vest RHF";;;;;;;;;;;;;;;;;;;;;;;;;;;;;
HST000477;Normal/Akutt;;001115;Ventilator, intensiv, voksen/barn;E037E-SV 900B;;;;;01.01.1980;01.01.1980;* Originale data (!SYS);;"Kassasjon ;  ;  ; Avdeling for medisinsk teknologi og informatikk ; Klinikk for Medisinsk teknologi ; Helse Stavanger HF ; Helse Vest RHF";;5-1;"Kassasjon ;  ;  ; Avdeling for medisinsk teknologi og informatikk ; Klinikk for Medisinsk teknologi ; Helse Stavanger HF ; Helse Vest RHF";;;0,00;0,00;"Kassasjon ;  ;  ; Avdeling for medisinsk teknologi og informatikk ; Klinikk for Medisinsk teknologi ; Helse Stavanger HF ; Helse Vest RHF";;;;;;;;;;;;;;;;;;;;;;;;;;;;;
HST000478;Normal/Akutt;;001115;Ventilator, intensiv, voksen/barn;E037E-SV 900B;;;;;01.01.1980;01.01.1980;* Originale data (!SYS);1000-TIMERS SERVICE BYTTET FILTERHUS + GRØNNLAMPE;"Kassasjon ;  ;  ; Avdeling for medisinsk teknologi og informatikk ; Klinikk for Medisinsk teknologi ; Helse Stavanger HF ; Helse Vest RHF";;5-1;"Kassasjon ;  ;  ; Avdeling for medisinsk teknologi og informatikk ; Klinikk for Medisinsk teknologi ; Helse Stavanger HF ; Helse Vest RHF";;;0,00;0,00;"Kassasjon ;  ;  ; Avdeling for medisinsk teknologi og informatikk ; Klinikk for Medisinsk teknologi ; Helse Stavanger HF ; Helse Vest RHF";;;;;;;;;;;;;;;;;;;;;;;;;;;;;
HST000479;Normal/Akutt;;001115;Ventilator, intensiv, voksen/barn;E037E-SV 900B;;;;;28.05.1990;28.05.1990;* Originale data (!SYS);"VISTE 2,5 LITER FOR MYE I EKSPIRERT MIN.VOLUM I FORHOLD TIL INNSTILT          
MIN.VOLUM ETTERJUSTERT INSPIRATORISK OG EKSPIRATORISK MIN.VOLUM               
SIKKERHETSTESTET OG FUNKSJONSTESTET, FUNNET OK.";"Kassasjon ;  ;  ; Avdeling for medisinsk teknologi og informatikk ; Klinikk for Medisinsk teknologi ; Helse Stavanger HF ; Helse Vest RHF";;5-1;"Kassasjon ;  ;  ; Avdeling for medisinsk teknologi og informatikk ; Klinikk for Medisinsk teknologi ; Helse Stavanger HF ; Helse Vest RHF";;;0,00;1,00;"Kassasjon ;  ;  ; Avdeling for medisinsk teknologi og informatikk ; Klinikk for Medisinsk teknologi ; Helse Stavanger HF ; Helse Vest RHF";;;;;;;;;;;;;;;;;;;;;;;;;;;;;
HST000480;Normal/Akutt;;001115;Ventilator, intensiv, voksen/barn;E037E-SV 900B;;;;;13.12.1990;13.12.1990;* Originale data (!SYS);"1000-TIMERS SERVICE.  UTFØRT 1000-TIMERS SERVICE. RETTET OPP FUNKSJONSVELGER  
FOR INSP. TID %, DA DENNE VAR MULIG Å SETTE TIL 70 % UTEN Å TRYKKE INN        
SPERRE- KNAPP (APP. VAR MODIFISERT). KUNNE VED Å SETTE INSP. TID OG PAUSETID  
FEIL, RISIKERE AT EKSP. UTEBLE. SIKKERHETS OG FUNKSJONSTESTET";"Kassasjon ;  ;  ; Avdeling for medisinsk teknologi og informatikk ; Klinikk for Medisinsk teknologi ; Helse Stavanger HF ; Helse Vest RHF";;5-1;"Kassasjon ;  ;  ; Avdeling for medisinsk teknologi og informatikk ; Klinikk for Medisinsk teknologi ; Helse Stavanger HF ; Helse Vest RHF";;;0,00;24,00;"Kassasjon ;  ;  ; Avdeling for medisinsk teknologi og informatikk ; Klinikk for Medisinsk teknologi ; Helse Stavanger HF ; Helse Vest RHF";;;;;;;;;;;;;;;;;;;;;;;;;;;;;
HST000481;Normal/Akutt;;001115;Ventilator, intensiv, voksen/barn;E037E-SV 900B;;;;;22.05.1991;22.05.1991;* Originale data (!SYS);"PÅKREVD 1000-TIMERS SERVICE.  UTFØRT 1000-TIMERS SERVICE, BYTTET DEFEKT       
NETT-LAMPE. SIKKERHETS OG FUNKSJONSTESTET, FUNNET OK.";"Kassasjon ;  ;  ; Avdeling for medisinsk teknologi og informatikk ; Klinikk for Medisinsk teknologi ; Helse Stavanger HF ; Helse Vest RHF";;5-1;"Kassasjon ;  ;  ; Avdeling for medisinsk teknologi og informatikk ; Klinikk for Medisinsk teknologi ; Helse Stavanger HF ; Helse Vest RHF";;;0,00;24,00;"Kassasjon ;  ;  ; Avdeling for medisinsk teknologi og informatikk ; Klinikk for Medisinsk teknologi ; Helse Stavanger HF ; Helse Vest RHF";;;;;;;;;;;;;;;;;;;;;;;;;;;;;
HST000482;Normal/Akutt;;001115;Ventilator, intensiv, voksen/barn;E037E-SV 900B;;;;;10.02.1993;10.02.1993;Rune Aalberg (aaruau);"MIN.VOL. FOR HØYT, 12L I STEDET FOR 10L  1000-TIMERS SERVICE UTFØRT.          
KALIBRERING MÅTTE GJØRES.";"Kassasjon ;  ;  ; Avdeling for medisinsk teknologi og informatikk ; Klinikk for Medisinsk teknologi ; Helse Stavanger HF ; Helse Vest RHF";;5-1;"Kassasjon ;  ;  ; Avdeling for medisinsk teknologi og informatikk ; Klinikk for Medisinsk teknologi ; Helse Stavanger HF ; Helse Vest RHF";;;0,00;503,00;"Kassasjon ;  ;  ; Avdeling for medisinsk teknologi og informatikk ; Klinikk for Medisinsk teknologi ; Helse Stavanger HF ; Helse Vest RHF";;;;;;;;;;;;;;;;;;;;;;;;;;;;;
HST000483;Normal/Akutt;;001115;Ventilator, intensiv, voksen/barn;E037E-SV 900B;;;;;24.11.1993;24.11.1993;Rune Aalberg (aaruau);"''0'' PÅ DISPLAY PÅ O2.  1000-TIMER SERVICE MED 02-CELLE-SKIFTE UTFØRT. TESTET  
OK!";"Kassasjon ;  ;  ; Avdeling for medisinsk teknologi og informatikk ; Klinikk for Medisinsk teknologi ; Helse Stavanger HF ; Helse Vest RHF";;5-1;"Kassasjon ;  ;  ; Avdeling for medisinsk teknologi og informatikk ; Klinikk for Medisinsk teknologi ; Helse Stavanger HF ; Helse Vest RHF";;;0,00;2,00;"Kassasjon ;  ;  ; Avdeling for medisinsk teknologi og informatikk ; Klinikk for Medisinsk teknologi ; Helse Stavanger HF ; Helse Vest RHF";;;;;;;;;;;;;;;;;;;;;;;;;;;;;
HST000484;Normal/Akutt;;001115;Ventilator, intensiv, voksen/barn;E037E-SV 900B;;;;;08.08.1994;08.08.1994;Rune Aalberg (aaruau);Å4 MMHG AVVIK PÅ LUFTVEISTRYKKET.  DRIFT I TRYKKTRANSDUCEREN KALIBRERT VEKK.;"Kassasjon ;  ;  ; Avdeling for medisinsk teknologi og informatikk ; Klinikk for Medisinsk teknologi ; Helse Stavanger HF ; Helse Vest RHF";;5-1;"Kassasjon ;  ;  ; Avdeling for medisinsk teknologi og informatikk ; Klinikk for Medisinsk teknologi ; Helse Stavanger HF ; Helse Vest RHF";;;0,00;1,00;"Kassasjon ;  ;  ; Avdeling for medisinsk teknologi og informatikk ; Klinikk for Medisinsk teknologi ; Helse Stavanger HF ; Helse Vest RHF";;;;;;;;;;;;;;;;;;;;;;;;;;;;;
HST000485;Normal/Akutt;;001115;Ventilator, intensiv, voksen/barn;E037E-SV 900B;;;;;22.11.1994;22.11.1994;Rune Aalberg (aaruau);"1500-TIMERS SEVICE.  BYTTET DEFFEKT STEPMOTOR (INSP. VALVE) OG UTFØRT 1500-   
TIMERS SERVICE.";"Kassasjon ;  ;  ; Avdeling for medisinsk teknologi og informatikk ; Klinikk for Medisinsk teknologi ; Helse Stavanger HF ; Helse Vest RHF";;5-1;"Kassasjon ;  ;  ; Avdeling for medisinsk teknologi og informatikk ; Klinikk for Medisinsk teknologi ; Helse Stavanger HF ; Helse Vest RHF";;;0,00;116,00;"Kassasjon ;  ;  ; Avdeling for medisinsk teknologi og informatikk ; Klinikk for Medisinsk teknologi ; Helse Stavanger HF ; Helse Vest RHF";;;;;;;;;;;;;;;;;;;;;;;;;;;;;
HST000486;Normal/Akutt;;001115;Ventilator, intensiv, voksen/barn;E037E-SV 900B;;;;;24.11.1995;24.11.1995;* Espen HELLANG (EH);TRIGGNIVÅ ALARMERER  KALIBRERT TRIG-NIVÅ;"Kassasjon ;  ;  ; Avdeling for medisinsk teknologi og informatikk ; Klinikk for Medisinsk teknologi ; Helse Stavanger HF ; Helse Vest RHF";;5-1;"Kassasjon ;  ;  ; Avdeling for medisinsk teknologi og informatikk ; Klinikk for Medisinsk teknologi ; Helse Stavanger HF ; Helse Vest RHF";;;0,00;187,00;"Kassasjon ;  ;  ; Avdeling for medisinsk teknologi og informatikk ; Klinikk for Medisinsk teknologi ; Helse Stavanger HF ; Helse Vest RHF";;;;;;;;;;;;;;;;;;;;;;;;;;;;;
HST000664;Normal/Akutt;;001191;Ventilator, intensiv, voksen/barn;E347E SV 900C;12.08.1999;;;;12.02.1991;12.02.1991;* Originale data (!SYS);"1000-TIMERS SERVICE PÅKREVD  UTFØRT 1000-TIMERS SERVICE. SIKKERHETS OG        
FUNKSJONSKONTROLLERT. FUNNET OK";"Kassasjon ;  ;  ; Avdeling for medisinsk teknologi og informatikk ; Klinikk for Medisinsk teknologi ; Helse Stavanger HF ; Helse Vest RHF";;5-1;"Kassasjon ;  ;  ; Avdeling for medisinsk teknologi og informatikk ; Klinikk for Medisinsk teknologi ; Helse Stavanger HF ; Helse Vest RHF";;;0,00;2,00;"Kassasjon ;  ;  ; Avdeling for medisinsk teknologi og informatikk ; Klinikk for Medisinsk teknologi ; Helse Stavanger HF ; Helse Vest RHF";;;;;;;;;;;;;;;;;;;;;;;;;;;;;
HST000665;Normal/Akutt;;001191;Ventilator, intensiv, voksen/barn;E347E SV 900C;12.08.1999;;;;11.04.1991;11.04.1991;* Originale data (!SYS);"1000-TIMERS SERVICE PÅKREVD  UTFØRT 1000-TIMERS SERVICE, BYTTET DEFEKT        
O2-CELLE. SIKKERHETS OG FUNKSJONSKONTROLLERT, FUNNET OK";"Kassasjon ;  ;  ; Avdeling for medisinsk teknologi og informatikk ; Klinikk for Medisinsk teknologi ; Helse Stavanger HF ; Helse Vest RHF";;5-1;"Kassasjon ;  ;  ; Avdeling for medisinsk teknologi og informatikk ; Klinikk for Medisinsk teknologi ; Helse Stavanger HF ; Helse Vest RHF";;;0,00;3,00;"Kassasjon ;  ;  ; Avdeling for medisinsk teknologi og informatikk ; Klinikk for Medisinsk teknologi ; Helse Stavanger HF ; Helse Vest RHF";;;;;;;;;;;;;;;;;;;;;;;;;;;;;
